nama_dokumen,kalimat,index,important,length,words_in_title,position,cue_words
Reza Al Husna_Kualifikasi.txt,2012. p enyakit kakao merupakan salah satu faktor yang berkontribusi terhadap penurunan biji bijian secara global serta dapat mempengaruhi pertumbuhan kesehatan dan produktivitas tanaman sehingga dapat merusak hasil panen.,16,1,19,0.08,0.37735849056603776,0.018867924528301886
Reza Al Husna_Kualifikasi.txt,beberapa penyakit utama yang menyerang tanaman kakao adalah penyakit kanker batang penyakit vascular streak dieback vsd cocoa swol len shoot virus cssv leaf blotch witches broom diseases wbd monilia pod rot dan antraknosa atau penyakit busuk buah yang disebabkan oleh phytophthora palmivora tumpal 2014. penyakit tersebut merupakan penyakit yang paling merugikan karena terdapat hampir di seluruh area penanaman kakao.,17,1,43,0.07142857142857142,0.33962264150943394,0.0
Reza Al Husna_Kualifikasi.txt,gejala yang dialami pada tanaman dapat bervariasi tergantung pada jenis penyaki t jenis tanaman yang terinfeksi dan 3 kondisi lingkungan.,18,1,14,0.05,0.3018867924528302,0.0
Reza Al Husna_Kualifikasi.txt,beberapa gejala pada tanaman yang terkena penyakit yaitu bercak atau lesi pada daun daun menguning atau rontok pertumbuhan terhambat atau kerusakan pada vena keropeng atau deformitas pada buah bunga tidak berkembang batang dan akar mengalami pembusukan produksi yang menurun dan kematian pada tanaman perlintan2023.,19,1,28,0.09375,0.2641509433962264,0.018867924528301886
Reza Al Husna_Kualifikasi.txt,penyakit tanaman kakao mempunyai banyak kesamaan sehingga sulit untuk mengidentifikasi jenis penyakit dan akurasi pengenalan penyakit mungkin rendah pada kondisi al ami patil dan kumar 2022 .,20,1,18,0.13636363636363635,0.22641509433962265,0.0
Reza Al Husna_Kualifikasi.txt,karena itu penelitian ini mengusulkan metode ml dan dl dalam tugas visi komputer untuk melakukan identifikasi dalam deteksi penyakit tanaman kakao yang lebih akurat .,21,1,14,0.21052631578947367,0.18867924528301888,0.0
Reza Al Husna_Kualifikasi.txt,banyak penelitian yang memanfaatkan ml dan dl untuk tugas visi komputer dalam mengenal penyakit tanaman.,22,1,10,0.11764705882352941,0.1509433962264151,0.0
Reza Al Husna_Kualifikasi.txt,secara umum penelitian penelitian sebelumnya menggunakan model seperti support vector machine svm dari ml digabungkan dengan metode ekstraksi fitur dan convolutional neural network cnn dari ml .,23,1,17,0.0,0.11320754716981132,0.0
Reza Al Husna_Kualifikasi.txt,pada penelitian rodriguez alfaro paredes esenarro hilarion 2021 digunakan hog lbp untuk ekstraksi fitur dan svm untuk klasifikasi penyakit pada tanaman.,24,1,15,0.09090909090909091,0.07547169811320754,0.0
Reza Al Husna_Kualifikasi.txt,penelitian harakannanavar rudagi puranikmath siddiqua pramodhini 2022 digunakan discrete wavelet transform dwt principal component analysis pca dan gray level co occurrence matrix glcm untuk ekstraksi fitur lokal dan model svm knearest neighbors knn dan cnn melakukan klasifikasi pada penyakit daun tanaman.,25,1,34,0.04878048780487805,0.03773584905660377,0.0
Reza Al Husna_Kualifikasi.txt,penelitian rachma d syarief rifka sonata setiawan rochman 2022 digunakan lbp untuk mengekstraksi fitur dan knn untuk klasifikasi penyakit daun jagung .,26,1,17,0.04,0.0,0.0
Reza Al Husna_Kualifikasi.txt,penelitian hosny el hady samy vrochidou papakostas 2023 digunakan lbp dan cnn untuk mendeteksi penyakit daun tanaman.,27,1,14,0.15,0.03773584905660377,0.0
Reza Al Husna_Kualifikasi.txt,selain dari model yang sudah disebutkan diatas terdapat salah satu inovasi terbaru model dl yang membawa kemajuan signifikan yaitu vision transformer vit yang memperkenalkan pendekatan baru untuk pengenalan citra.,28,1,17,0.09090909090909091,0.07547169811320754,0.0
Reza Al Husna_Kualifikasi.txt,vit mengadopsi konsep transformer yang awalnya dikembangkan untuk tugas tugas natural language processing nlp.,29,1,11,0.11764705882352941,0.11320754716981132,0.018867924528301886
Reza Al Husna_Kualifikasi.txt,transformer menggunakan attention mechanism untuk fokus pada bagian bagian 4 penting dari input data sehingga meningkatkan kemampuan model dalam memahami konteks yang kompleks vaswani et al.,30,1,16,0.041666666666666664,0.1509433962264151,0.018867924528301886
Reza Al Husna_Kualifikasi.txt,2017. dalam bidang pertanian vit diterapkan untuk memantau pertumbuhan tanaman dan mendeteksi penyakit tanaman yang membantu petani dalam mengambil keputusan yang lebih tepat dan cepat.,31,1,16,0.15,0.18867924528301888,0.0
Reza Al Husna_Kualifikasi.txt,berbeda dengan beberapa penelitian diatas penelitian ini mengadopsi pendekatakan feature fusion berbasis attention.,32,1,10,0.058823529411764705,0.22641509433962265,0.0
Reza Al Husna_Kualifikasi.txt,feature fusion berbasis attention merupakan metode yang menggabungkan fitur fitur yang diekstraksi dengan mekanisme attention untuk meningkatkan kinerja model.,33,1,14,0.05,0.2641509433962264,0.018867924528301886
Reza Al Husna_Kualifikasi.txt,mekanisme attention memberikan kemampuan pada model untuk fokus pada bagian bagian penting dari input sehingga meningkatkan representasi fitur yang lebih relevan hu et al.,34,1,13,0.0,0.3018867924528302,0.018867924528301886
Reza Al Husna_Kualifikasi.txt,2018 .,35,1,0,0.0,0.33962264150943394,0.0
Reza Al Husna_Kualifikasi.txt,penelitian borhani et al.,36,1,0,0.0,0.37735849056603776,0.0
Reza Al Husna_Kualifikasi.txt,2022 mengeksplorasi model vit dalam pengklasifikasian penyakit tanaman.,37,1,7,0.14285714285714285,0.41509433962264153,0.0
Reza Al Husna_Kualifikasi.txt,menggabungkan blok konvolusional dengan blok attention transformer membantu model mendapatkan akurasi yang tinggi.,38,1,10,0.058823529411764705,0.4528301886792453,0.0
Reza Al Husna_Kualifikasi.txt,hasil akurasi dari model hybrid yang diusulkan masing masing dataset mencapai 100 pada dataset daun padi 917 pada dataset karat gandum dan 9877 dataset plantvillage .,39,1,18,0.0,0.49056603773584906,0.018867924528301886
Reza Al Husna_Kualifikasi.txt,penelitian lye dan ng 2023 melakukan klasifikasi penyakit tanaman menggunakan vit.,40,1,8,0.13333333333333333,0.5283018867924528,0.0
Reza Al Husna_Kualifikasi.txt,penelitian ini berfokus identifikasi pada keseluruhan daun dibandingkan bagian individual atau b agian tertentu.,41,1,9,0.0,0.5660377358490566,0.0
Reza Al Husna_Kualifikasi.txt,mereka menggunakan modul attention mechanism locality self attention sla untuk membantu fokus dalam identifikasi keseluruhan daun.,42,1,11,0.0,0.6037735849056604,0.0
Reza Al Husna_Kualifikasi.txt,hasil akurasi yang diperoleh adalah 8958 serta ketahanan model yang memuaskan terhadap perubahan orientasi dan posisi daun.,43,1,11,0.0,0.6415094339622641,0.018867924528301886
Reza Al Husna_Kualifikasi.txt,tabbakh barpanda 2023 mengeksplorasi pendekatan feature fusion yaitu menggabungkan model transfer learning dengan model vit yang diberi nama tlmvit untuk klasifikasi penyakit daun tanaman.,44,1,19,0.08,0.6792452830188679,0.0
Reza Al Husna_Kualifikasi.txt,penelitian ini melakukan dua fase ekstraksi fitur yaitu ekstraksi fitur awal menggunakan model pretrained dan ekstraksi fitur mendalam dilakukan menggunakan model vit.,45,1,13,0.0,0.7169811320754716,0.0
Reza Al Husna_Kualifikasi.txt,model diklasifikasi kan menggunakan mlp dan diuji dengan lima model pretrained dan vit.,46,1,7,0.0,0.7547169811320755,0.0
Reza Al Husna_Kualifikasi.txt,model yang diusulkan pada penelitian ini dapat 5 mengungguli model transfer learning lainnya dengan peningkatan akurasi sebesar 111 dan 1099 .,47,1,12,0.0,0.7924528301886793,0.018867924528301886
Reza Al Husna_Kualifikasi.txt,berdasarkan uraian latar belakang dan analisis terhadap penelitian penelitian sebelumnya model transformer mampu mencatat bagian bagian tertentu yang berbeda secara bersamaan dan memahami keterkaitan bagian tersebut yang sangat pentin g untuk pengenalan fitur penyakit gao r et al.,48,1,22,0.07142857142857142,0.8301886792452831,0.0
Reza Al Husna_Kualifikasi.txt,2024 .,49,1,0,0.0,0.8679245283018868,0.0
Reza Al Husna_Kualifikasi.txt,pada penelitian jesse douha dan lenka 2024 mengidentifikasi penyakit tanaman kakao menggunakan vit masih memiliki keterbatasan model dalam variasi latar belakang yang kompleks serta mengandung noise yang tinggi.,50,1,19,0.12,0.9056603773584906,0.0
Reza Al Husna_Kualifikasi.txt,sel ain itu penelitian ini masih terbatas hanya pada satu kelas penyakit saja.,51,1,7,0.06666666666666667,0.9433962264150944,0.0
Reza Al Husna_Kualifikasi.txt,oleh karena itu masih terbuka peluang untuk mengembangka n metode menggunakan teknik feature fusion berbasis attention untuk mengoptimalkan model dengan menggabungkan ekstraksi fitur dan vit serta menambahkan variasi pada dataset yang bertujuan untuk meningkatkan ketahanan dan generalisasi pada model.,52,1,23,0.03333333333333333,0.9811320754716981,0.018867924528301886
Robert_Kualifikasi.txt,penelitian tentang robot cerdas terus meningkat dari tahun ke tahun mukherjee gupta chang najjaran 2022 .,0,1,9,0.0,0.9743589743589743,0.02564102564102564
Robert_Kualifikasi.txt,robot cerdas merupakan robot yang dapat melakukan tugas dengan berintaksi dengan linkungan sekitarnya .,1,1,6,0.0,0.9230769230769231,0.0
Robert_Kualifikasi.txt,pada umumnya robot cerdas dikembangkan untuk bidang industri garcia jimenez de santos armada 2007 .,2,1,11,0.05,0.8717948717948718,0.02564102564102564
Robert_Kualifikasi.txt,salah satu contoh robot cerdas yang digunakan pada bidang industri adalah welding robot .,3,0,8,0.0,0.8205128205128205,0.0
Robert_Kualifikasi.txt,welding robot merupakan robot yang dapat melakukan proses pengelasan pada sebuah objek tanpa campur tangan manusia coman rontescu bogatu cicic 2021 .,4,1,14,0.0,0.7692307692307693,0.0
Robert_Kualifikasi.txt,namun selain robot dalam bidang industri penelitian tentang robot cerdas bidang sosial menjadi salah satu penelitian terbanyak dalam beberapa tahun terakhir johal 2020 .,5,1,12,0.0,0.717948717948718,0.0
Robert_Kualifikasi.txt,robot sosial merupakan robot yang didisain untuk berinteraksi dengan manusia rawal stock homburg 2022 retto 2017 .,6,1,12,0.0,0.6666666666666666,0.0
Robert_Kualifikasi.txt,robot sosial tersebut didisain agar dapat berinteraksi layaknya seperti manusia di mana robot harus memiliki kemampuan berkomunikasi dalam bahasa tingkat tinggi hegel muhl wrede fastabend sagerer 2009 .,7,1,18,0.0,0.6153846153846154,0.02564102564102564
Robert_Kualifikasi.txt,salah satu contoh robot sosial adalah sophia sophia merupakan robot yang manusia dan dapat melakukan percakapan dengan manusia dalam bahasa tingkat tinggi mengenal wajah seseorang dan mengeluarkan ekspresi dan namun tidak memiliki kemampuan untuk mengenal ekspresi wajah seseorang retto 2017 .,8,0,23,0.125,0.5641025641025641,0.02564102564102564
Robert_Kualifikasi.txt,ekspresi wajah merupakan salah satu komponen penting agar robot dapat berkomunikasi sesuai dengan keadaan frith 2009 .,9,1,9,0.11764705882352941,0.5128205128205128,0.0
Robert_Kualifikasi.txt,selain bidang robotika ekspresi wajah juga berperan penting dalam bidang psikologi di mana emosi seseorang dapat mempengaruhi pengambilan keputusan seseorang george dane 2016 berdasarkan penelitian rawal stock homburg 2022 55 informasi afektif didapatkan melalui ekspresi wajah .,10,1,26,0.06451612903225806,0.46153846153846156,0.0
Robert_Kualifikasi.txt,4 artificial intelligence ai adalah bidang yang digunakan agar mesin dapat berpikir dan mengambil keputusan layaknya seperti manusia khanzode 2020 .,11,1,13,0.0,0.41025641025641024,0.0
Robert_Kualifikasi.txt,ai merupakan bidang yang sangat luas didalam ai terdapat machine learning ml di mana ml memungkinkan untuk mesin untuk belajar dari data yang diberikan serta berpikir dan mengambil keputusan awad khanna 2015 khanzode 2020 .,12,1,20,0.0,0.358974358974359,0.0
Robert_Kualifikasi.txt,walaupun demikian performa dari ml sangat bergantung pada proses ekstrasi fitur alzubaidi zhang humaidi aldujaili duan alshamma 2021 shinde shah 2018 .,13,1,16,0.0,0.3076923076923077,0.0
Robert_Kualifikasi.txt,oleh karena itu terdapat pembelajaran yang lebih dalam dari ml yaitu deep learning dl .,14,1,0,0.0,0.2564102564102564,0.0
Robert_Kualifikasi.txt,dl memungkinkan mesin tidak hanya belajar berpikir dan mengambil keputusan namun dapat memilih data mana yang penting dan yang tidak penting dalam mengambil keputusan sehingga membuat mesin tidak terlalu terpengaruh oleh noise data tidak penting janiesch zschech heinrich 2021 .,15,1,18,0.0,0.20512820512820512,0.0
Robert_Kualifikasi.txt,banyak penelitian yang memanfaatkan ml dan dl untuk mengenal ekspresi wajah .,16,1,7,0.21428571428571427,0.15384615384615385,0.0
Robert_Kualifikasi.txt,secara garis besar penelitian penelitian tersebut menggunakan model support vector mach ine svm dari model ml yang digabung dengan metode ekstrasi fitur atau menggunakan model convolution al neural network cnn dari model dl.,17,1,23,0.11538461538461539,0.10256410256410256,0.0
Robert_Kualifikasi.txt,pada penelitian shan gong mcowan 2009 digunakan local binary pattern lbp untuk ekstrasi fitur dan svm sebagai model untuk mengenal ekspresi wajah berdasarkan dari hasil ekstrasi fitur lbp.,18,1,21,0.16666666666666666,0.05128205128205128,0.02564102564102564
Robert_Kualifikasi.txt,pada penelitian mohammad ali 2011 digunakan local monotonic pattern lmp untuk ekstrasi fitur dan svm.,19,1,11,0.0,0.0,0.0
Robert_Kualifikasi.txt,pada penelitian deshmukh patwardhan mahajan 2016 digunakan viola jones algorithm vja untuk deteksi wajah lbp dan svm untuk membuat sistem pengenalan ekspresi wajah secara real time.,20,1,19,0.16666666666666666,0.05128205128205128,0.0
Robert_Kualifikasi.txt,pada penelitian sawardekar naik 2018 digunakan lbp cnn dan knearest neighbor knn model ml untuk pengenalan ekspresi wajah.,21,1,13,0.21052631578947367,0.10256410256410256,0.0
Robert_Kualifikasi.txt,pada penelitian turabzadeh meng swash pleva juhar 2018 digunakan lbp dan knn untuk membangun sistem pengenalan ekspresi wajah secara realtime.,22,1,15,0.19047619047619047,0.15384615384615385,0.02564102564102564
Robert_Kualifikasi.txt,penelitian eleyan 2023 dilakukan analisis berbagai histogram based feature extraction algorithm dan knn.,23,1,10,0.0,0.20512820512820512,0.0
Robert_Kualifikasi.txt,selain dari model model yang sudah disebutkan di atas terdapat penelitian yang mengembangkan model dl yang memanfaatkan morfologi matematika untuk melakukan ekstrasi fitur yaitu morphological neural network 5 mnn .,24,1,16,0.2631578947368421,0.2564102564102564,0.02564102564102564
Robert_Kualifikasi.txt,hasil penelitian shen zhong shih 2022 menunjukkan bahwa mnn memiliki performa yang setara dengan cnn namun dengan kompleksitas yang rendah.,25,1,13,0.0,0.3076923076923077,0.02564102564102564
Robert_Kualifikasi.txt,secara garis besar model cnn dan mnn memiliki arstektur yang mirip perbedaan dari kedua model tersebut adalah cnn menggunakan konvolusi untuk ekstrasi fitur sedangkan mnn menggunakan morfologi untuk ekstrasi fitur kedua model kemudian menghubungkan lapisan ekstrasi fitur ke ful ly connected layer fclayer yang dapat dikatan seb uah artificial neural network ann untuk melakukan klasifikasi objek .,26,1,35,0.12121212121212122,0.358974358974359,0.0
Robert_Kualifikasi.txt,jenis morfologi yang digunakan untuk model mnn pada penelitian shen et al.,27,1,8,0.058823529411764705,0.41025641025641024,0.0
Robert_Kualifikasi.txt,2019 adalah opening dengan structure element se yang digunakan adalah disk.,28,1,0,0.0,0.46153846153846156,0.0
Robert_Kualifikasi.txt,se merupakan komponen penting dalam operasi morfologi.,29,1,0,0.0,0.5128205128205128,0.0
Robert_Kualifikasi.txt,se digunakan untuk penentuan pengambilan nilai dalam sebuah area pada citra .,30,1,0,0.0,0.5641025641025641,0.0
Robert_Kualifikasi.txt,hasil dari operasi morfologi opening tidak mengekstrasi fitur secara utuh .,31,1,7,0.0,0.6153846153846154,0.02564102564102564
Robert_Kualifikasi.txt,berdasarkan uraian diatas maka dalam penelitian ini diusulkan pengembangan model klasi fikasi morphological neural network untuk sistem pengenalan ekspresi wajah .,32,1,16,0.5294117647058824,0.6666666666666666,0.02564102564102564
Robert_Kualifikasi.txt,dalam penelitian ini diusulkan metode ekstrasi fitur menggunakan operasi morfologi yang meminimalisir hilangnya fitur akibat operasi.,33,1,12,0.0,0.717948717948718,0.0
Robert_Kualifikasi.txt,operasi yang diusulkan kemudian dikembangkan menjadi sebuah model mnn yang dapat mengekstrasi dan juga mengenali ekspresi wajah manusia.,34,1,10,0.25,0.7692307692307693,0.02564102564102564
Robert_Kualifikasi.txt,selain itu penelitian ini juga melakukan pengenalan ekspresi wajah menggunakan model svm dan cnn.,35,1,7,0.3076923076923077,0.8205128205128205,0.0
Robert_Kualifikasi.txt,svm terdapat metode tambahan yang digunakan untuk meng ekstrasi fitur ekspresi wajah .,36,1,8,0.125,0.8717948717948718,0.0
Robert_Kualifikasi.txt,dalam penelitian ini model model tersebut mnn svm dan cnn akan dilatih menggunakan dataset gabungan baik dataset primer maupun sekunder.,37,1,12,0.05263157894736842,0.9230769230769231,0.0
Robert_Kualifikasi.txt,pengenalan ekspresi wajah menggunakan model svm dan cnn juga merupakan lanjutan dari penelitian robert 2023 di mana pada penelitian tersebut terdapat kekurangan yang dapat dilakukan dalam penelitian ini seperti keterbatasan dataset dan kurangnya variasi etnis.,38,1,18,0.19047619047619047,0.9743589743589743,0.0
Tatya Atyanti Paramastri_Kualifikasi.txt,teknologi digital memainkan peran penting dalam meningkatkan pelestarian meningkatkan kesadaran masyarakat dan wadah pembelajaran warisan budaya.,0,1,13,0.0,0.9818181818181818,0.01818181818181818
Tatya Atyanti Paramastri_Kualifikasi.txt,batik adalah salah satu pusaka budaya milik indonesia yang telah diakui oleh unesco sebagai mahakarya pusaka kemanusiaan lisan dan tak benda pada tahun 2009 silam.,1,1,15,0.041666666666666664,0.9454545454545454,0.0
Tatya Atyanti Paramastri_Kualifikasi.txt,kain batik diakui oleh unesco karena kain ini tidaklah hanya sebuah kain bercorak secara fisik tetapi sebuah kain yang sarat dengan simbol serta makna dari doa dan harapan.,2,1,14,0.047619047619047616,0.9090909090909091,0.0
Tatya Atyanti Paramastri_Kualifikasi.txt,tidak lama setelah proklamasi kemerdekaan indonesia presiden ir.,3,1,0,0.0,0.8727272727272727,0.0
Tatya Atyanti Paramastri_Kualifikasi.txt,soekarno mengangkat batik jawa sebagai batik indonesia.,4,1,6,0.06666666666666667,0.8363636363636363,0.0
Tatya Atyanti Paramastri_Kualifikasi.txt,salah satu daerah yang perkembangan batiknya sangat baik adalah yogyakarta.,5,1,0,0.23076923076923078,0.8,0.01818181818181818
Tatya Atyanti Paramastri_Kualifikasi.txt,di yogyakarta sendiri terdapat sebutan batik daur hidup yogyakarta.,6,1,6,0.3333333333333333,0.7636363636363637,0.0
Tatya Atyanti Paramastri_Kualifikasi.txt,hal ini menegaskan bahwa pada awalnya motif batik memiliki makna yang lahir seiring daur hidup manusia.,7,1,9,0.25,0.7272727272727273,0.0
Tatya Atyanti Paramastri_Kualifikasi.txt,upacara ritual yang terkait dengan daur hidup sangat erat dengan masyarakat jawa yang selalu mempertahankan keseimbangan dengan lingkungannya.,8,1,11,0.1,0.6909090909090909,0.0
Tatya Atyanti Paramastri_Kualifikasi.txt,pelaksanaan upacara ritual ini dilakukan dengan menggunakan piranti dan bahan yang digunakan seharihari termasuk kain batik.,9,1,8,0.05555555555555555,0.6545454545454545,0.0
Tatya Atyanti Paramastri_Kualifikasi.txt,daur hidup yang dikatakan adalah sejak janin dalam kandungan ibu lahir bertumbuh dan berkembang menikah sampai kembali kealam baka sekar jagad 2015. terdapat ratusan motif batik khas yogyakarta dimana masingmasing motif memiliki maknanya tersendiri.,10,1,24,0.21428571428571427,0.6181818181818182,0.01818181818181818
Tatya Atyanti Paramastri_Kualifikasi.txt,sebagai contoh pada motif yang umum dikenal seperti parang dan kawung motif parang rusak merupakan pola dasar dari parang motif ini memiliki makna perang melawan yang rusak yaitu perilaku yang tidak baik.,11,0,19,0.041666666666666664,0.5818181818181818,0.0
Tatya Atyanti Paramastri_Kualifikasi.txt,motif ini memiliki berbagai jenis dan ukuran.,12,1,0,0.07142857142857142,0.5454545454545454,0.0
Tatya Atyanti Paramastri_Kualifikasi.txt,parang rusak dengan ukuran bidang parang lebih dari 8 cm parang barong hanya dikenakan oleh raja.,13,1,11,0.0,0.509090909090909,0.0
Tatya Atyanti Paramastri_Kualifikasi.txt,hingga saat ini motif batik ini masih dilarang dikenakan di area puro pakualaman yogyakarta.,14,1,8,0.1875,0.4727272727272727,0.0
Tatya Atyanti Paramastri_Kualifikasi.txt,sedangkan motif kawung melambangkan ajaran tentang proses terjadinya kehidupan manusia dengan manusia sebagai pusat yang ketika lahirdisertai dengan 4 saudara yaitu darah air ketuban ariari dan tali pusar yang selama dalam kandungan menjaga bayi supaya selamat lahir ke dunia.,15,1,24,0.0625,0.43636363636363634,0.0
Tatya Atyanti Paramastri_Kualifikasi.txt,motif kawung juga melambangkan harapan kehidupan yang mapan lahir dan batin.,16,1,8,0.11764705882352941,0.4,0.0
Tatya Atyanti Paramastri_Kualifikasi.txt,batik ini khususnya dapat digunakan untuk acara kelahiran tedhak siten ruwatan dan kematian.,17,1,7,0.058823529411764705,0.36363636363636365,0.0
Tatya Atyanti Paramastri_Kualifikasi.txt,kedua batik ini tidak disarankan untuk digunakan pada acara pernikahan.,18,1,0,0.07142857142857142,0.32727272727272727,0.0
Tatya Atyanti Paramastri_Kualifikasi.txt,a b gambar 1.1 a batik parang b batik kawung belakangan ini kain dan busana batik kembali marak digunakan pada acara acara formal seperti pernikahan lamaran rapat penting dan lainnya.,19,1,22,0.038461538461538464,0.2909090909090909,0.0
Tatya Atyanti Paramastri_Kualifikasi.txt,terutama setelah tamutamu penting negara mengenakan busana batik pada acara kenegaraan banyak kaum muda yang kembali memperhatikan trend busana batik.,20,1,13,0.05,0.2545454545454545,0.0
Tatya Atyanti Paramastri_Kualifikasi.txt,namun pengetahuan tentang batik tidak diturunkan dalam pelajaran resmi sehingga ilmu batik tidak menurun dengan baik pada masyarakat luas.,21,1,10,0.05555555555555555,0.21818181818181817,0.0
Tatya Atyanti Paramastri_Kualifikasi.txt,kurangnya pengetahuan mengenai makna dibalik motif batik sering kali membuat kesan yang ditampilkan menjadi kurang nyaman.,22,1,10,0.10526315789473684,0.18181818181818182,0.0
Tatya Atyanti Paramastri_Kualifikasi.txt,sebagai contoh penggunaan kain batik dengan motif yang jarang dilihat sering kali menarik perhatian lebih supaya busana yang dikenakan tidak sama dengan tamu undangan lainnya.,23,0,14,0.08695652173913043,0.14545454545454545,0.0
Tatya Atyanti Paramastri_Kualifikasi.txt,namun ditemukan beberapa kejadian dimana tamu undangan pernikahan mengenakan kain batik slobog karena motif batik ini dianggap baru muncul geometris simple dan memiliki motif yang cantik.,24,1,19,0.07692307692307693,0.10909090909090909,0.0
Tatya Atyanti Paramastri_Kualifikasi.txt,secara umum lobog memiliki arti longgar atau lancar.,25,1,0,0.0,0.07272727272727272,0.0
Tatya Atyanti Paramastri_Kualifikasi.txt,namun kain batik slobog ini biasa digunakan pada acara kematian dengan harapan arwah akan kembali kealam keabadian dengan lancar karena berjalan di jalan yang longgar tanpa halangan.,26,1,14,0.043478260869565216,0.03636363636363636,0.0
Tatya Atyanti Paramastri_Kualifikasi.txt,sehingga kain ini kurang tepat untuk digunakan pada acara pernikahan.,27,1,0,0.0,0.0,0.0
Tatya Atyanti Paramastri_Kualifikasi.txt,gambar 1.2 batik slobog tidak hanya dalam pemakaian batik saat ini batik kombinasi atau batik modern juga marak dipasarkan.,28,1,13,0.05,0.03636363636363636,0.0
Tatya Atyanti Paramastri_Kualifikasi.txt,namun menurut dewan ahli ppbi sekar jagad ibu mari s. condronegoro dalam beberapa pameran juga ditemukan batik kombinasi yang mengandung makna berseberangan yang digabungkan dalam satu kain.,29,1,17,0.037037037037037035,0.07272727272727272,0.0
Tatya Atyanti Paramastri_Kualifikasi.txt,selain itu ketersediaan informasi mengenai batik daur hidup ini juga masih terbatas.,30,1,6,0.21428571428571427,0.10909090909090909,0.0
Tatya Atyanti Paramastri_Kualifikasi.txt,motif batik yang sangat beragam dengan maknanya yang berbedabeda membuatnya sulit untuk dikenali dan dibutuhkan pengetahuan khusus.,31,1,11,0.1,0.14545454545454545,0.01818181818181818
Tatya Atyanti Paramastri_Kualifikasi.txt,dalam hal ini dibutuhkan peran teknologi untuk mempermudahnya.,32,1,0,0.0,0.18181818181818182,0.0
Tatya Atyanti Paramastri_Kualifikasi.txt,salah satu alternatif yang dapat membantu adalah deteksi otomatis pada motif batik dengan melakukan sistem klasifikasi berbasis citra.,33,1,11,0.2222222222222222,0.21818181818181817,0.0
Tatya Atyanti Paramastri_Kualifikasi.txt,klasifikasi berbasis citra adalah pengkategorian citra digital kedalam kelas kelas berdasarkan informasi tertentu yang terdapat dalam citra tersebut.,34,1,13,0.10526315789473684,0.2545454545454545,0.0
Tatya Atyanti Paramastri_Kualifikasi.txt,informasi ini dapat berupa tekstur warna bentuk dan lainnya.,35,1,0,0.0,0.2909090909090909,0.0
Tatya Atyanti Paramastri_Kualifikasi.txt,beberapa studi telah melakukan klasifikasi terhadap motif batik dengan berbagai metode klasik dan deep learning tetapi masih ditemukan beberapa kekuarangan yang terjadi.,36,1,11,0.15789473684210525,0.32727272727272727,0.0
Tatya Atyanti Paramastri_Kualifikasi.txt,salah satu yang paling berpengaruh adalah dataset yang tidak sesuai tidak mendukung atau tidak akurat meranggi yudistira dan sari 2022 fitriani tresnawati dan sukriyansah 2023 anggoro marzukidan supriyanti 2024. sehingga diperlukan pengambilan dataset primer dengan bantuan ahli.,37,1,23,0.0,0.36363636363636365,0.0
Tatya Atyanti Paramastri_Kualifikasi.txt,selain itu kebanyakan penelitian klasifikasi berfokus pada metode cnn ilahi dkk.,38,1,8,0.05555555555555555,0.4,0.0
