nama_dokumen,kalimat,index,important,conjunction,length,words_in_title,position,cue_words
Kualifikasi_Rama Dian Syah.txt,"Peneliti Anak Agung Putri Ratna dan kawan-kawan (Ratna et al., 2021) melakukan penelitian mengembangkan metode kriptografi dengan menggunakan algoritma Arnold's Cat Map dan Henon Map.",19,1,0,27,0.13636363636363635,0.7037037037037037,1
Kualifikasi_Rama Dian Syah.txt,Teknik konfusi digunakan pada algoritma Arnold's Cat Map dan teknik difusi digunakan pada algoritma Henon Map.,20,1,0,13,0.06666666666666667,0.7407407407407407,0
Kualifikasi_Rama Dian Syah.txt,Hasil penelitian membuktikan bahwa teknik konfusi dan difusi dapat memberikan keamanan yang baik pada metode kriptografi citra digital.,21,1,0,19,0.2,0.7777777777777778,1
Kualifikasi_Rama Dian Syah.txt,"Peneliti Shazia Sabir dan kawan-kawan (Sabir & Guleria, 2021) melakukan penelitian mengembangkan metode kriptografi citra digital menggunakan algoritma Arnold's Cat Map, Reality Preserving Two Dimensional Discrete Fractional Hertley Transform dan Random Matrix Affine Cipher.",22,1,0,37,0.16666666666666666,0.8148148148148148,1
Kualifikasi_Rama Dian Syah.txt,Hasil penelitian yaitu metode diterapkan pada enkripsi citra digital dengan multi-layer warna komponen RGB.,23,1,1,15,0.125,0.8518518518518519,1
Kualifikasi_Rama Dian Syah.txt,"Peneliti Arwa Benlashram dan kawan-kawan (Benlashram et al., 2020) melakukan penelitian mengembangkan metode kriptografi citra digital menggunakan metode pengacakan piksel dan 3D Chaotic Map.",24,1,0,25,0.3333333333333333,0.8888888888888888,1
Kualifikasi_Rama Dian Syah.txt,"Hasil penelitian menunjukkan performa keamanan dengan menggunakan parameter nilai korelasi,
      entropi, NPCR (Number of Pixel Change Rate) dan UACI (Unified Average Change Intensity).",25,1,0,26,0.0,0.9259259259259259,1
Kualifikasi_Rama Dian Syah.txt,Dari uraian diatas dapat disimpulkan bahwa metode kriptografi citra digital berbasis chaotic dapat dikembangkan untuk meningkatkan performa keamanan.,26,1,1,18,0.42857142857142855,0.9629629629629629,3
Kualifikasi_Rama Dian Syah.txt,"Penelitian ini mengusulkan pengembangan metode kriptografi citra digital dengan menggunakan kombinasi dari Cat Map, Henon Map dan Logistic Map menggunakan teknik konfusi dan difusi agar proses kriptografi dapat meningkatkan keamanan dengan melalui beberapa pengujian.",27,1,0,30,0.23809523809523808,1,2
Kualifikasi_Aris Gunaryati.txt,"Penelitian terkait analisis runtun waktu (time series) dan peramalan (forecasting) adalah bidang penelitian yang aktif, artinya sampai saat ini masih terus dilakukan penelitian mengenai keakuratan dalam proses peramalan runtun waktu terkait dengan proses pengambilan keputusan.",0,1,0,32,0.07407407407407407,1,0
Kualifikasi_Aris Gunaryati.txt,"Beberapa penelitian yang melakukan riset pada runtun waktu menggunakan metode statistik, jaringan syaraf (neural network), wavelet, maupun system fuzzy.",1,1,0,23,0.17391304347826086,0.967741935483871,0
Kualifikasi_Aris Gunaryati.txt,"[1, 2]
Metode peramalan runtun waktu lebih menitikberatkan proses pada upaya mencari pola data, dan bukan untuk menjelaskan mengapa ada pola seperti itu.",2,1,0,26,0.125,0.935483870967742,0
Kualifikasi_Aris Gunaryati.txt,"Metode ini akan lebih cocok jika kebutuhan hanyalah ingin mengetahui berapa angka yang akan diprediksi untuk periode mendatang dan tidak perlu campur tangan dari luar untuk mempengaruhi hasil prediksi, karena sandaran satu-satunya adalah data historis yang memang sudah terjadi dan tidak dapat ditarik kembali.",3,1,0,41,0.06896551724137931,0.9032258064516129,1
Kualifikasi_Aris Gunaryati.txt,Metode peramalan data runtun waktu secara umum terbagi menjadi dua bagian.,4,1,1,12,0.17647058823529413,0.8709677419354839,0
Kualifikasi_Aris Gunaryati.txt,"Pertama, metode peramalan dengan cara matematika statistik seperti moving average, exponential smoothing, analisis trend serta yang paling sering digunakan adalah ARIMA (Box Jenkins).",5,1,0,27,0.11538461538461539,0.8387096774193549,0
Kualifikasi_Aris Gunaryati.txt,"Kedua, metode peramalan yang didasarkan pada kecerdasan buatan seperti neural network, algoritma genetika, simulated annealing, genetic programming, klasifikasi dan model hybrid.",6,1,0,23,0.10344827586206896,0.8064516129032258,1
Kualifikasi_Aris Gunaryati.txt,Tidak semua metode dapat digunakan secara efektif pada semua data.,7,1,1,10,0.125,0.7741935483870968,0
Kualifikasi_Aris Gunaryati.txt,Metode-metode tersebut memiliki kekurangan dan kelebihan yang berbeda.,8,1,0,9,0.05263157894736842,0.7419354838709677,0
Kualifikasi_Aris Gunaryati.txt,"Terlebih lagi, masalah dalam dunia nyata seringkali merupakan masalah yang kompleks dan satu model mungkin tidak mampu mengatasi hal tersebut dengan baik [2].",9,1,0,26,0.0,0.7096774193548387,0
Kualifikasi_Aris Gunaryati.txt,"Pemilihan metode-metode tersebut tergantung pada berbagai aspek yang mempengaruhi yaitu aspek waktu, pola data, tipe model system yang diamati, tingkat keakuratan ramalan yang diinginkan dan sebagainya.",10,1,0,25,0.06896551724137931,0.6774193548387097,1
Kualifikasi_Aris Gunaryati.txt,Karena itulah muncul suatu masalah jika pengamatan atau pengujian dilakukan pada suatu system dinamis yang memiliki system pola data dengan formulasi yang selalu berubah-ubah atau dengan kata lain system yang memiliki tingkat kesulitan yang tinggi untuk dibuatkan formulasi modelnya pada suatu kurun waktu tertentu.,11,1,0,33,0.03333333333333333,0.6451612903225806,2
Kualifikasi_Aris Gunaryati.txt,"Di samping itu, untuk menerapkan metode statistik tersebut data harus memenuhi beberapa asumsi-asumsi tertentu sesuai dengan pola data.",12,1,1,19,0.08695652173913043,0.6129032258064516,0
Kualifikasi_Aris Gunaryati.txt,Dengan teknologi di bidang kecerdasan buatan (Artificial Intellegence) yaitu teknologi jaringan syaraf tiruan (Neural Network) maka identifikasi pola data dari system dapat dilakukan dengan metode pendekatan pembelajaran atau pelatihan yaitu untuk menentukan bobot penghubung antar simpul yang optimum.,13,1,0,38,0.11428571428571428,0.5806451612903225,2
Kualifikasi_Aris Gunaryati.txt,Keunggulan utama jaringan syaraf tiruan adalah kemampuan komputasi yang paralel dengan cara belajar dari pola-pola yang diajarkan.,14,1,1,17,0.0,0.5483870967741935,0
Kualifikasi_Aris Gunaryati.txt,"Berdasarkan kemampuan belajar yang dimilikinya, maka jaringan syaraf tiruan dapat dilatih untuk mempelajari dan menganalisa pola data masa lalu dan berusaha mencari suatu formula atau fungsi yang akan menghubungkan pola data masa lalu dengan keluaran yang diinginkan pada saat ini maupun pada masa mendatang.",15,1,0,37,0.03125,0.5,0
Kualifikasi_Aris Gunaryati.txt,Dalam sebuah studi komparatif (studi perbandingan) telah dilakukan penelitian terhadap model peramalan runtun waktu yang memiliki trend dan pola musiman untuk mengetahui apakah model yang lebih kompleks selalu menghasilkan forecast (ramalan) yang lebih baik daripada model statistika.,16,1,0,34,0.06896551724137931,0.5161290322580645,1
Kualifikasi_Aris Gunaryati.txt,"Dalam studi perbandingan tersebut, metode yang dibandingkan adalah model Winter's Decomposition, Time Series Regression, ARIMA dan Neural Network.",17,1,0,21,0.20833333333333334,0.5483870967741935,0
Kualifikasi_Aris Gunaryati.txt,Hasilnya diperoleh kesimpulan bahwa model yang kompleks tidak selalu menghasilkan forecast (ramalan) yang lebih baik dibandingkan model statistitika sederhana.,18,1,1,20,0.0,0.5806451612903226,2
Kualifikasi_Aris Gunaryati.txt,Data yang digunakan dalam penelitian tersebut adalah data penumpang pesawat internasional dari bulan Januari 1949 sampai bulan Desember 1960.,19,1,0,18,0.043478260869565216,0.6129032258064516,0
Kualifikasi_Aris Gunaryati.txt,"[3]
Untuk metode peramalan yang kompleks dengan data yang sangat banyak, dibutuhkan suatu metode yang tidak hanya berbasis kecerdasan buatan lagi.",20,1,1,22,0.08333333333333333,0.6451612903225806,1
Kualifikasi_Aris Gunaryati.txt,Saat machine learning sudah dikembangkan untuk mengenali dan mempelajari pola suatu data sehingga dapat memberikan hasil prediksi yang benar berdasarkan pola data tersebut.,21,1,0,22,0.04,0.6774193548387096,2
Kualifikasi_Aris Gunaryati.txt,"Karena peningkatan jumlah data yang akan diprediksi, maka dalam beberapa tahun terakhir, para peneliti telah menyelidiki apakah komputer kuantum dapat digunakan untuk meningkatkan kinerja algoritma machine learning.",22,1,0,29,0.038461538461538464,0.7096774193548387,1
Kualifikasi_Aris Gunaryati.txt,Dengan adanya efek mekanika kuantum seperti superposisi dan keterlibatan (entanglement) maka komputer kuantum diharapkan dapat memberikan keuntungan untuk memecahkan masalah tertentu lebih cepat daripada komputer klasik.,23,1,0,27,0.0,0.7419354838709677,0
Kualifikasi_Aris Gunaryati.txt,"Meskipun komputer kuantum masih dalam tahap percobaan, namun algoritma kuantum telah dikembangkan selama dua dekade terakhir.",24,1,0,17,0.0,0.7741935483870968,1
Kualifikasi_Aris Gunaryati.txt,Algoritma kuantum melibatkan masalah seperti faktorisasi bilangan-bilangan besar dan optimalisasi dengan yang terakhir efektif digunakan dalam percepatan algoritma machine learning.,25,1,0,20,0.0,0.8064516129032258,0
Kualifikasi_Aris Gunaryati.txt,"Salah satu algoritma machine learning yang sudah dikembangkan saat ini untuk metode peramalan adalah metode Quantum Neural Network (QNN) [4, 5]
Berdasarkan latar belakang tersebut maka dalam penelitian ini penulis tertarik untuk membuat suatu metode peramalan berbasis komputasi kuantum dari metode peramalan Hybrid Arima Neural Network (Quantum ARIMA Neural Network) dengan studi kasus data pertambahan jumlah kasus harian covid 19 di Jakarta.",26,1,1,54,0.36363636363636365,0.8387096774193549,1
Kualifikasi_Aris Gunaryati.txt,"Studi kasus ini dilakukan untuk mengendalikan penyebaran Covid 19 melalui analisis prediksi penambahan kasus harian baik jumlah yang positif, meninggal dan sembuh dari Covid 19 di periode yang akan datang.",27,1,0,28,0.2608695652173913,0.8709677419354839,0
Kualifikasi_Aris Gunaryati.txt,"Beberapa penelitian telah dilakukan untuk membuat model prediksi Covid 19 ini, di antaranya menggunakan model pertumbuhan logistik dan model dinamik [6] model ARIMA [7, 8], model hibrid ARIMA dan wavelet [9], model ARIMA machine learning [10] dan model-model lainnya [11-15].",28,1,0,35,0.09375,0.9032258064516129,0
Kualifikasi_Aris Gunaryati.txt,Dalam penelitian ini akan dilakukan analisis runtun waktu pertambahan jumlah kasus harian Covid 19 di Jakarta dengan metode Hybrid Quantum ARIMA NN berdasarkan dataset dari situs https://corona.jakarta.go.id tanggal 6 Maret 2020 sampai 30 Juni 2021 sebagai data training dan nanti akan diprediksi untuk tanggal 1 Juli 2021 sampai dengan 31 Juli 2021 sebagai data uji.,29,1,0,49,0.2894736842105263,0.9354838709677419,0
Kualifikasi_Aris Gunaryati.txt,Tujuan umum dari penelitian ini adalah untuk mengembangkan model prediksi Quantum ARIMA NN yang diharapkan dapat menghasilkan tingkat akurasi yang tinggi dengan komputasi yang tidak terlalu lama dalam pengolahan data yang cukup besar.,30,1,1,31,0.10714285714285714,0.967741935483871,3
Kualifikasi_Aris Gunaryati.txt,"Tujuan khususnya adalah menganalisis data pertambahan jumlah kasus harian Covid 19 di Jakarta menggunakan metode ARIMA, Neural Network, Hybrid Arima NN dan Quantum ARIMA NN dan membandingkan akurasinya",31,1,0,25,0.5238095238095238,1,0
Fitriana Indah Pramitasari_Kualifikasi.txt,Teknologi Informasi (TI) merupakan ilmu bidang teknologi yang dikembangkan untuk membantu berbagai pekerjaan manusia.,0,1,1,16,0.05,1,1
Fitriana Indah Pramitasari_Kualifikasi.txt,"Perkembangan Teknologi Informasi (TI) dalam kecerdasan buatan atau artificial intelligence (AI), telah membawa perubahan di berbagai sektor.",1,1,0,21,0.14285714285714285,0.9855072463768115,2
Fitriana Indah Pramitasari_Kualifikasi.txt,"AI merupakan teknologi yang paling trending dan hits di era digital saat ini (Chollet, 2021).",2,1,0,19,0.0,0.9710144927536232,0
Fitriana Indah Pramitasari_Kualifikasi.txt,Salah satu sektor yang mengalami perubahan dengan adanya TI dalam ranah AI adalah sektor pertanian.,3,1,1,15,0.05263157894736842,0.9565217391304348,0
Fitriana Indah Pramitasari_Kualifikasi.txt,"Dimana, para petani dapat memanfaatkan teknologi untuk meningkatkan dan mengefisienkan produktivitas mereka.",4,1,0,14,0.05263157894736842,0.9420289855072463,1
Fitriana Indah Pramitasari_Kualifikasi.txt,"Menurut data yang bersumber dari BPS tahun 2023, Jumlah Usaha Pertanian Perorangan (UTP) sebanyak 29.342.202 unit atau turun 7,45 persen dari tahun 2013 yang 
sebanyak 31.705.295 unit.",5,1,0,26,0.03225806451612903,0.927536231884058,0
Fitriana Indah Pramitasari_Kualifikasi.txt,"Menurut Kepala Badan Pusat Statistik (BPS) Amalia Adininggar Widyasanti, masalah pendidikan dalam dunia pertanian menjadi salah satu penyebab rendahnya produktivitas petani di tanah air.",6,1,1,28,0.03571428571428571,0.9130434782608696,0
Fitriana Indah Pramitasari_Kualifikasi.txt,Dimana 75% petani hanya berpendidikan tamatan Sekolah Dasar (SD).,7,1,1,13,0.05263157894736842,0.8985507246376812,0
Fitriana Indah Pramitasari_Kualifikasi.txt,"Selain itu, usia petani menjadi salah satu faktor menurunnya produktivitas petani.",8,1,1,12,0.05555555555555555,0.8840579710144927,0
Fitriana Indah Pramitasari_Kualifikasi.txt,Sebanyak 58% dari total petani di Indonesia berusia >45 tahun.,9,1,1,13,0.05555555555555555,0.8695652173913043,0
Fitriana Indah Pramitasari_Kualifikasi.txt,"Mantan Wakil Menteri Pertanian, Bayu Khrisnamurti menjelaskan bahwa pendapatan petani per bulan hanya mencapai Rp 1 juta rupiah dan hal tersebut menyebabkan tenaga petani turun sebanyak 5 juta dalam 10 tahun terakhir.",10,1,0,32,0.034482758620689655,0.855072463768116,0
Fitriana Indah Pramitasari_Kualifikasi.txt,"Berdasarkan indeks ketahanan pangan (GFSI) 2022, dapat diukur dengan empat indikator yaitu keterjangkauan harga pangan (affordability), ketersediaan pasokan (availability), kualitas nutrisi (quality and safety), serta keberlanjutan dan adaptasi (sustainability and adaptation).",11,1,0,33,0.029411764705882353,0.8405797101449275,0
Fitriana Indah Pramitasari_Kualifikasi.txt,Konsumsi pangan global cenderung meningkat lebih cepat dibandingkan pasokannya.,12,1,1,10,0.05263157894736842,0.8260869565217391,1
Fitriana Indah Pramitasari_Kualifikasi.txt,"Hal ini berkaitan dengan isu-isu global yang penting seperti pertumbuhan populasi (Rozi., et al, 2023).",13,1,1,19,0.0,0.8115942028985508,0
Fitriana Indah Pramitasari_Kualifikasi.txt,"Dengan pesatnya pertumbuhan populasi dan meningkatnya permintaan pangan di seluruh dunia, peningkatan produktivitas dalam prosedur pertanian sangatlah penting (Zarandi., et al, 2022).",14,1,0,26,0.04,0.7971014492753623,1
Fitriana Indah Pramitasari_Kualifikasi.txt,"Kentang merupakan salah satu tanaman komersial penting yang berkontribusi terhadap ketahanan pangan dan mengurangi kemiskinan di kalangan petani kecil di negara berkembang (Mijena., et al, 2022).",15,1,0,29,0.11538461538461539,0.782608695652174,1
Fitriana Indah Pramitasari_Kualifikasi.txt,"Tanaman kentang dianggap sebagai tanaman yang berpotensi tinggi untuk ketahanan pangan karena menghasilkan kuantitas yang besar, dan memberikan produk berkualitas tinggi dalam waktu tanam yang singkat.",16,1,0,24,0.043478260869565216,0.7681159420289855,1
Fitriana Indah Pramitasari_Kualifikasi.txt,"Kentang memiliki sejarah panjang dalam membantu mengatasi masalah ketahanan pangan dan berkontribusi terhadap peningkatan pendapatan masyarakat, terutama di masa-masa sulit dan juga di tengah ekspansi populasi saat ini (Devaux.,et al, 2021).",17,1,0,34,0.03333333333333333,0.7536231884057971,1
Fitriana Indah Pramitasari_Kualifikasi.txt,Transformasi digital di bidang pertanian merupakan tren penting dalam praktik dan tata kelola yang berkelanjutan.,18,1,0,16,0.05,0.7391304347826086,0
Fitriana Indah Pramitasari_Kualifikasi.txt,"Dalam beberapa tahun terakhir, berbagai sensor telah digunakan di bidang pertanian untuk mengumpulkan data dalam jumlah besar yang memungkinkan analisis lebih cepat dan kompleks.",19,1,0,25,0.05,0.7246376811594203,0
Fitriana Indah Pramitasari_Kualifikasi.txt,"Pergeseran paradigma ini telah mengarah pada pengelolaan pertanian berbasis data, yang membantu petani dalam proses pengambilan keputusan (Romani., et al, 2023).",20,1,1,25,0.08,0.7101449275362319,0
Fitriana Indah Pramitasari_Kualifikasi.txt,"Platform digital juga menjadi tempat untuk industri berkolaborasi, membagikan data, menciptakan bersama, dan menyediakan layanan digital yang mendukung keberlanjutan (Chavez., et al, 2023).",21,1,0,26,0.037037037037037035,0.6956521739130435,1
Fitriana Indah Pramitasari_Kualifikasi.txt,"Banyak platform berbasis kecerdasan buatan yang telah dimanfaatkan untuk membantu kegiatan bisnis, manufaktur, perkantoran dan sebagainya (Gladysz., et al, 2023).",22,1,0,24,0.18181818181818182,0.6811594202898551,1
Fitriana Indah Pramitasari_Kualifikasi.txt,"Transformasi digital memainkan peran penting dalam meningkatkan pembagian informasi dan pemrosesan informasi dalam rantai pasokan (Balci., et al, 2024).",23,1,0,21,0.08333333333333333,0.6666666666666667,1
Fitriana Indah Pramitasari_Kualifikasi.txt,"Platform digital menawarkan peluang untuk meningkatkan ketahanan rantai pasokan manufaktur dalam menghadapi kompleksitas, tantangan berbagi data, pemicu tekanan eksternal (misalnya kelangkaan sumber daya, faktor geopolitik), risiko yang muncul, dan kelestarian lingkungan (Chari., et al, 2023).",24,0,0,39,0.075,0.6521739130434783,1
Fitriana Indah Pramitasari_Kualifikasi.txt,Sehingga adanya platform koperasi diharapkan dapat membantu mensejahterakan petani.,25,1,0,10,0.2,0.6376811594202898,0
Fitriana Indah Pramitasari_Kualifikasi.txt,Petani dapat menjual hasil panen dari platform koperasi secara langsung kepada konsumen.,26,1,1,13,0.17647058823529413,0.6231884057971014,1
Fitriana Indah Pramitasari_Kualifikasi.txt,Kecerdasan buatan digunakan pada platform koperasi petani untuk memproses dan menganalisis data besar dan cepat pada rantai pasok.,27,1,0,17,0.4375,0.6086956521739131,1
Fitriana Indah Pramitasari_Kualifikasi.txt,"Sehingga, dapat meningkatkan efisiensi dan produktifitas pertanian.",28,1,0,9,0.0625,0.5942028985507246,1
Fitriana Indah Pramitasari_Kualifikasi.txt,Platform koperasi pada penelitian ini juga berdasarkan konsep economic sharing.,29,1,1,11,0.11764705882352941,0.5797101449275363,0
Fitriana Indah Pramitasari_Kualifikasi.txt,"Platform economic sharing memanfaatkan teknologi sebagai model bisnis di berbagai 
sektor dalam pertukaran ekonomi (Dabija, et al, 2022; Sari, et al, 2022).",30,1,1,24,0.08,0.5652173913043479,0
Fitriana Indah Pramitasari_Kualifikasi.txt,"Economic sharing mampu memecah proses bisnis dan sektor industri dan menjadikannya pasar yang 
tembus pandang dalam skala internasional karena ekspansi yang pesat termasuk Gojek, Grab, dan Maxim untuk layanan ride-hailing dan Airbnb untuk akomodasi (Kauffman & 
Naldi, 2020; Sari, et al, 2022).",31,1,0,42,0.0,0.5507246376811594,0
Fitriana Indah Pramitasari_Kualifikasi.txt,Transparansi rantai pasokan sering kali dipandang sebagai elemen penting untuk memecahkan banyak tantangan.,32,1,1,14,0.1111111111111111,0.536231884057971,0
Fitriana Indah Pramitasari_Kualifikasi.txt,"Terutama yang berkaitan dengan sektor bahan baku, 
transparansi yang lebih besar sering kali diharapkan dapat memecahkan masalah utama dengan memastikan asal usul produk dan memungkinkan keterlacakan di sepanjang rantai 
pasokan.",33,1,0,30,0.08333333333333333,0.5217391304347826,0
Fitriana Indah Pramitasari_Kualifikasi.txt,"Secara khusus, teknologi blockchain yang terdesentralisasi dapat menjamin keamanan data yang lebih besar dan menawarkan peluang untuk menciptakan aset dan 
informasi digital dengan tingkat kekekalan dan transparansi yang tinggi (Rosi, et al, 2019 ; Angela, et al, 2021).",34,1,0,36,0.0,0.5,2
Fitriana Indah Pramitasari_Kualifikasi.txt,"Blockchain dapat membuat catatan yang tidak dapat diubah, kuat terhadap perubahan data atau anti-rusak, sehingga memberikan konsistensi di seluruh jaringan.",35,1,0,21,0.0,0.5072463768115942,0
Fitriana Indah Pramitasari_Kualifikasi.txt,"Blockchain juga terdesentralisasi, dikombinasikan dengan karakter catatan yang tidak dapat diubah, yang menghasilkan transparansi antara anggota jaringan (Shuaib et al.",36,1,1,22,0.0,0.5217391304347826,1
Fitriana Indah Pramitasari_Kualifikasi.txt,"2020; Alamsyah, et al, 2022).",37,1,1,9,0.0,0.5362318840579711,0
Fitriana Indah Pramitasari_Kualifikasi.txt,"Selain teknologi blockchain, kecerdasan buatan juga memiliki peran penting dalam mengoptimalkan rantai pasokan melalui berbagai metode analisis dan prediksi.",38,1,0,21,0.2,0.5507246376811594,1
Fitriana Indah Pramitasari_Kualifikasi.txt,"Dalam konteks manajemen rantai pasok, ANN dapat digunakan untuk peramalan permintaan, optimalisasi, inventaris, perencanaan logistik, dan deteksi anomali (Sooria, et 
al, 2023).",39,1,0,26,0.07407407407407407,0.5652173913043478,0
Fitriana Indah Pramitasari_Kualifikasi.txt,Peramalan permintaan digunakan dalam penelitian ini untuk memprediksi permintaan di masa depan selama periode tertentu.,40,1,1,15,0.0,0.5797101449275363,0
Fitriana Indah Pramitasari_Kualifikasi.txt,"Tujuannya untuk meminimalisir risiko 
stok over dan stok yang kosong.",41,1,0,10,0.0,0.5942028985507246,0
Fitriana Indah Pramitasari_Kualifikasi.txt,Permasalahan tersebut dapat diatasi dengan kombinasi inventory management.,42,1,1,9,0.0,0.6086956521739131,0
Fitriana Indah Pramitasari_Kualifikasi.txt,"Sistem inventory management memiliki peran penting untuk 
memantau kondisi barang pada tahap rantai pasokan distribusi barang dari gudang pusat ke ritel sesuai dengan permintaan konsumen.",43,1,1,25,0.07142857142857142,0.6231884057971014,0
Fitriana Indah Pramitasari_Kualifikasi.txt,"Beberapa metode telah dikembangkan untuk 
memecahkan masalah proses inventory management di gudang pusat.",44,1,1,14,0.05263157894736842,0.6376811594202898,1
Fitriana Indah Pramitasari_Kualifikasi.txt,Safety Stock adalah salah satu metode yang menggunakan analisis kontrol stok.,45,1,1,12,0.0,0.6521739130434783,0
Fitriana Indah Pramitasari_Kualifikasi.txt,"Dimana metode safety stock 
digunakan untuk menentukan stok minimum dan maksimum (Devi, et al, 2018).",46,1,0,19,0.0,0.6666666666666666,0
Fitriana Indah Pramitasari_Kualifikasi.txt,Safety stock dianggap sebagai salah satu cara yang dapat mengurangi resiko kehabisan stok.,47,1,1,14,0.0,0.6811594202898551,0
Fitriana Indah Pramitasari_Kualifikasi.txt,"Sehingga dalam rantai pasok, inventory management yang efektif dapat memastikan layanan yang terbaik kepada pelanggan dan mempertahankan reputasi perusahaan (Chamani, et al, 2022).",48,1,0,26,0.08,0.6956521739130435,0
Fitriana Indah Pramitasari_Kualifikasi.txt,Kombinasi antara teknologi blockchain dengan ai membuka peluang baru untuk mengoptimalkan efesiensi dan transparansi dan transparansi dalam manajemen rantai pasok.,49,1,0,19,0.09090909090909091,0.7101449275362319,0
Fitriana Indah Pramitasari_Kualifikasi.txt,"Bersama dengan kecerdasan buatan, blockchain menjadi bagian dari teknologi terdepan dalam ekonomi digital (Alamsyah, et al, 2022).",50,1,1,21,0.09523809523809523,0.7246376811594203,1
Fitriana Indah Pramitasari_Kualifikasi.txt,"Dalam penerapan ini, algoritma ANN dapat diintegrasikan ke dalam blockchain untuk memprediksi permintaan dan mengelola inventaris, termasuk penentuan safety stock secara otomatis.",51,1,0,23,0.0,0.7391304347826086,0
Fitriana Indah Pramitasari_Kualifikasi.txt,"Dengan mencatat semua transaksi dan data permintaan dalam blockchain, keamanan dan transparansi informasi tetap terjaga, memungkinkan sistem manajemen inventaris yang lebih efisien dan handal.",52,1,0,24,0.0,0.7536231884057971,0
Fitriana Indah Pramitasari_Kualifikasi.txt,"Penelitian yang telah dilakukan sebelumnya terkait platform untuk petani adalah pendekatan platform untuk pemrosesan informasi pertanian cerdas, dimana sebuah 
pendekatan desain yang dimaksud untuk memandu pembanguanan sistem pertanian cerdas yang efektif, andal dan kuat.",53,1,0,28,0.12,0.7681159420289855,0
Fitriana Indah Pramitasari_Kualifikasi.txt,"Platform pertanian cerdas akan menghasilkan peningkatan 
produktivitas, profitabilitas, dan kinerja pertanian pintar yang terhubung (Zarandi., et al, 2022).",54,1,0,21,0.13043478260869565,0.782608695652174,2
Fitriana Indah Pramitasari_Kualifikasi.txt,"Kedua, terdapat penelitian yang menyajikan platform AgroAPI yang menyediakan akses data dan model untuk sektor pertanian melalui Application Programming Interface (API).",55,1,0,24,0.125,0.7971014492753623,0
Fitriana Indah Pramitasari_Kualifikasi.txt,"API pada AgroAPI berfokus pada produktivitas petani, indikasi tanggal tanam, klasifikasi tanah, cuaca, katalog bio-input, dan indeks vegetasi yang diperoleh dari citra satelit (Romani., et al, 2023).",56,1,0,30,0.030303030303030304,0.8115942028985508,0
Fitriana Indah Pramitasari_Kualifikasi.txt,Beberapa penelitian baru-baru ini yang berkaitan dengan metode ANN untuk teknik peramalan permintaan telah dilakukan.,57,1,1,16,0.0,0.8260869565217391,0
Fitriana Indah Pramitasari_Kualifikasi.txt,Dalam kinerja ANN memiliki keuntungan pada lingkungan bisnis yang terus berubah dan prediksi permintaan untuk membuat keputusan yang tepat mengenai manufaktur dan inventory management.,58,1,0,23,0.0,0.8405797101449275,0
Fitriana Indah Pramitasari_Kualifikasi.txt,Algoritma pembelajaran prediksi digunakan untuk prediksi deret waktu yang lebih baik di masa depan.,59,1,1,14,0.0,0.855072463768116,0
Fitriana Indah Pramitasari_Kualifikasi.txt,"Menggunakan pendekatan ANN memberikan akurasi yang lebih tinggi dalam proses prediksi permintaan (Ashvin dan Suman, 2015).",60,1,0,20,0.0,0.8695652173913043,0
Fitriana Indah Pramitasari_Kualifikasi.txt,Penelitian sebelumnya membahas tentang cara mengatur safety stock.,61,1,1,9,0.0,0.8840579710144928,0
