nama_dokumen,kalimat,index,important,length,words_in_title,position,cue_words
Kualifikasi_Aris Gunaryati.txt,keunggulan utama jaringan syaraf tiruan adalah kemampuan komputasi yang paralel dengan cara belajar dari pola pola yang diajarkan.,13,1,12,0.0,0.1,0.0
Kualifikasi_Aris Gunaryati.txt,berdasarkan kemampuan belajar yang dimilikinya maka jaringan syaraf tiruan dapat dilatih untuk mempelajari dan menganalisa pola data masa lalu dan berusaha mencari suatu formula atau fungsi yang akan menghubungkan pola data masa lalu dengan keluaran yang diinginkan pada saat ini maupun pada masa mendatang.,14,1,21,0.03225806451612903,0.03333333333333333,0.0
Kualifikasi_Aris Gunaryati.txt,dalam sebuah studi komparatif studi perbandingan telah dilakukan penelitian terhadap model peramalan runtun waktu yang memiliki trend dan pol a musiman untuk mengetahui apakah model yang lebih kompleks selalu menghasilkan forecast ramalan yang lebih baik daripada model statistika.,15,1,20,0.06896551724137931,0.03333333333333333,0.03333333333333333
Kualifikasi_Aris Gunaryati.txt,dalam studi perbandingan tersebut metode yang dibandingkan adalah model winters decomposition time series regre ssion arima dan neural network .,16,1,14,0.22727272727272727,0.1,0.0
Kualifikasi_Aris Gunaryati.txt,hasilnya diperoleh kesimpulan bahwa model yang kompleks tidak selalu menghasilkan forecast ramalan yang lebih baik dibandingkan model statistitika sederhana.,17,1,12,0.0,0.16666666666666666,0.03333333333333333
Kualifikasi_Aris Gunaryati.txt,data yang digunakan dalam penelitian tersebut adalah data penum pang pesawat internasional dari bulan januari 1949 sampai bulan desember 1960.,18,1,11,0.043478260869565216,0.23333333333333334,0.0
Kualifikasi_Aris Gunaryati.txt,3 untuk metode peramalan yang kompleks dengan data yang sangat banyak dibutuhkan suatu metode yang tidak hanya berbasis kecerdasan buatan lagi.,19,1,11,0.09090909090909091,0.3,0.03333333333333333
Kualifikasi_Aris Gunaryati.txt,saat machine learning sudah di kembangkan untuk mengenali dan mempelajari pola suatu data sehingga dapat memberikan hasil prediksi yang benar berdasarkan pola data tersebut.,20,1,13,0.041666666666666664,0.36666666666666664,0.03333333333333333
Kualifikasi_Aris Gunaryati.txt,karena peningkatan jumlah data yang akan diprediksi maka d alam beberapa tahun terakhir para peneliti telah meny elidiki apakah komputer kuantum dapat digunakan untuk meningkatkan kinerja algoritma machine learning .,21,1,15,0.037037037037037035,0.43333333333333335,0.03333333333333333
Kualifikasi_Aris Gunaryati.txt,dengan adanya efek mekanika kuantum seperti superposisi dan keterlibatan entanglement maka komputer kuantum diharapkan dapat memberikan keuntungan untuk memecahkan masalah tertentu lebih cepat daripada komputer klasik.,22,1,14,0.0,0.5,0.0
Kualifikasi_Aris Gunaryati.txt,meskipun komputer kuantum masih dalam tahap percobaan namun algoritma kuantum telah dikembangkan selama dua dekade terakhir.,23,1,9,0.0,0.5666666666666667,0.03333333333333333
Kualifikasi_Aris Gunaryati.txt,algoritma kuantum melibatkan masalah seperti faktorisasi bilan ganbilangan besar dan optimalisasi dengan yang terakhir efektif digunakan dalam percepatan algoritma machine learning .,24,1,12,0.0,0.6333333333333333,0.0
Kualifikasi_Aris Gunaryati.txt,salah satu algoritma machine learning yang sudah dikembangkan saat ini untuk metode peramalan adalah metode quantum neural network qnn 4 5 5 berdasarkan latar belakang tersebut maka dalam penelitian ini penulis tertarik untuk me mbuat suatu metode peramalan berbasis komputasi kuantum dari metode peramalan hybrid arima neural network quantum arima neural network dengan studi kasus data pertambahan jumlah kasus har ian cov id 19 di jakarta.,25,1,46,0.2631578947368421,0.7,0.03333333333333333
Kualifikasi_Aris Gunaryati.txt,studi kasus ini dilakukan u ntuk mengendalikan penyebaran covid 19 melalui analisis prediksi penambahan kasus harian baik jumlah yang positif meninggal dan sembuh dari covid 19 di periode yang akan datang.,26,1,18,0.25,0.7666666666666667,0.0
Kualifikasi_Aris Gunaryati.txt,beberapa penelitian telah dilakukan untuk membuat model prediksi covid 19 in i di antaranya menggunakan model pertumbuhan logistik dan model dinamik 6 model arima 7 8 model hibrid arima dan wavelet 9 model arima machine learning 10 dan modelmodel lainnya 1115. dalam penelitian ini akan dilakukan analisis runtun waktu pertambahan jumlah kasus harian cov id 19 di jakarta dengan metode hybrid quantum arima nn berdasarkan dataset dari si tus httpscorona.jakarta.go.id tanggal 6 maret 2020 sampai 30 juni 2021 sebagai data training dan nanti akan diprediksi untuk tanggal 1 juli 2021 sampai dengan 31 juli 2021 sebagai data uji.,27,1,70,0.2037037037037037,0.8333333333333334,0.0
Kualifikasi_Aris Gunaryati.txt,tujuan umum dari penelitian ini adalah untuk mengembangkan model prediksi quantum arima nn yang diharapkan dapat menghasilkan tingkat akurasi yang tinggi dengan komputasi yang tidak terlalu lama dalam pengolahan data yang cukup besar.,28,1,16,0.1111111111111111,0.9,0.03333333333333333
Kualifikasi_Aris Gunaryati.txt,tujuan khususnya adalah menganalisis data pertambahan jumlah kasus harian covid 19 di jakarta menggunakan metode arima neural network hybrid arima nn dan quantum arima n n dan membandingkan akurasinya,29,1,21,0.5238095238095238,0.9666666666666667,0.0
Kualifikasi_Rama Dian Syah.txt,perkembangan teknologi dan komunikasi menyebabkan digitalisasi pada media citra untuk memberikan informasi .,0,1,8,0.15384615384615385,0.9736842105263158,0.02631578947368421
Kualifikasi_Rama Dian Syah.txt,digitalisasi media citra dapat memudahkan akses dan modifikasi terhadap konten pada data yang ditransmisikan.,1,1,9,0.06666666666666667,0.9210526315789473,0.0
Kualifikasi_Rama Dian Syah.txt,kemudahan pada digitalisasi citra menyebabkan peluang terhadap kejahatan yan g mungkin terjadi seperti akses tidak sah modifikasi konten pelanggaran hak cipta dan lain lain hamza 2019 .,2,1,17,0.043478260869565216,0.868421052631579,0.02631578947368421
Kualifikasi_Rama Dian Syah.txt,keamanan data menjadi sangat penting pada media digital untuk menghindari kejahatan yang mengancam data yang bersifat rahasia dan privasi.,3,1,11,0.0625,0.8157894736842105,0.0
Kualifikasi_Rama Dian Syah.txt,berbagai teknologi dan komunikasi menggunakan media gambar atau citra di semua aspek untuk memudahkan pengguna.,4,1,8,0.07142857142857142,0.7631578947368421,0.0
Kualifikasi_Rama Dian Syah.txt,citra dapat mengandung berbagai arti dan makna dalam menggambarkan suatu objek data atau informasi.,5,1,8,0.07142857142857142,0.7105263157894737,0.0
Kualifikasi_Rama Dian Syah.txt,keamanan citra diperlukan untuk melindungi makna informasi yang ada di dalamnya .,6,1,6,0.08333333333333333,0.6578947368421053,0.0
Kualifikasi_Rama Dian Syah.txt,kriptografi merupakan ilmu yang berhubungan dengan transformasi data untuk membuat artinya tidak dipahami untuk menyembunyikan maknanya mencegahnya dari perubahan tanpa izin atau mencegahnya dari penggunaan yang tidak sah.,7,1,14,0.05263157894736842,0.6052631578947368,0.0
Kualifikasi_Rama Dian Syah.txt,kriptografi menggunakan berba gai macam teknik matematika untuk menjaga konten pada pesan terenkripsi joshi karkade 2015 .,8,1,12,0.05555555555555555,0.5526315789473685,0.0
Kualifikasi_Rama Dian Syah.txt,kriptografi pada citra dapat diterapkan dengan metode chaotic .,9,1,0,0.3333333333333333,0.5,0.0
Kualifikasi_Rama Dian Syah.txt,metode chaotic merupakan teknik untuk enkripsi yang berdasarkan gerakan atau dinamika yang rumit dan tidak terduga tergantung pada k eadaan atau kondisi awal pada seb uah sistem lone et al.,10,1,19,0.04,0.4473684210526316,0.0
Kualifikasi_Rama Dian Syah.txt,2021 .,11,1,0,0.0,0.39473684210526316,0.0
Kualifikasi_Rama Dian Syah.txt,beberapa algoritma yang merupakan kriptografi berbasis chaotic yaitu algoritma cat map henon map ratna et al.,12,1,12,0.3076923076923077,0.34210526315789475,0.0
Kualifikasi_Rama Dian Syah.txt,2021 dan logistic map lone et al.,13,1,6,0.08333333333333333,0.2894736842105263,0.0
Kualifikasi_Rama Dian Syah.txt,2021 .,14,1,0,0.0,0.23684210526315788,0.0
Kualifikasi_Rama Dian Syah.txt,cat map merupakan algoritma yang ditemukan oleh ahli matematik rusia bernama vladimir arnold yang membuktikan algoritmanya pada citra kucing ratna et al.,15,1,17,0.09090909090909091,0.18421052631578946,0.0
Kualifikasi_Rama Dian Syah.txt,2021 .,16,1,0,0.0,0.13157894736842105,0.0
Kualifikasi_Rama Dian Syah.txt,henon map adalah algoritma yang ditemukan oleh ahli matematik perancis bernama michael henon dan merupakan bentuk simplifikasi 5 algoritma dari mod el algoritma lorentz ratna et al.,17,1,21,0.041666666666666664,0.07894736842105263,0.0
Kualifikasi_Rama Dian Syah.txt,2021 .,18,1,0,0.0,0.02631578947368421,0.0
Kualifikasi_Rama Dian Syah.txt,logistic map merupakan algoritma yang ditemukan oleh ahli matematik belgia bernama pierre francois verhulst yang awalnya diterapkan untuk menghitung populasi maksimum masyarakat untuk sumber daya yang terbatas chen et al.,19,1,22,0.03571428571428571,0.02631578947368421,0.0
Kualifikasi_Rama Dian Syah.txt,2021 .,20,1,0,0.0,0.07894736842105263,0.0
Kualifikasi_Rama Dian Syah.txt,peneliti aesha elghandour dan kawan kawan elghandour et al.,21,1,8,0.0,0.13157894736842105,0.0
Kualifikasi_Rama Dian Syah.txt,2021 melakukan penelitian mengembangkan metode kriptografi citra digital dengan teknik konfus i dan difusi menggunakan algoritma logistic map sebagai konfusi dan twodimensional piecewise smooth nonlinier chaotic map sebagai difusi .,22,1,22,0.2857142857142857,0.18421052631578946,0.02631578947368421
Kualifikasi_Rama Dian Syah.txt,hasil penelitian tersebut membukitkan keamanan algoritma dengan melalui beberapa analisis pengujian yaitu performa keamanan analisis histogram dan noise .,23,1,12,0.0,0.23684210526315788,0.02631578947368421
Kualifikasi_Rama Dian Syah.txt,peneliti parveiz nazir lone dan kawan kawan lone et al.,24,1,9,0.0,0.2894736842105263,0.0
Kualifikasi_Rama Dian Syah.txt,2021 melakukan penelitian mengembangkan metode kriptografi menggunakan al goritma random matrix affine cipher henon map dan logistic map.,25,1,15,0.16666666666666666,0.34210526315789475,0.02631578947368421
Kualifikasi_Rama Dian Syah.txt,hasil penelitian tersebut yaitu algoritma yang diusulkan diterapkan pada citra berwarna .,26,1,7,0.07692307692307693,0.39473684210526316,0.02631578947368421
Kualifikasi_Rama Dian Syah.txt,penelit i anak agung putri ratna dan kawan kawan ratna et al.,27,1,11,0.0,0.4473684210526316,0.0
Kualifikasi_Rama Dian Syah.txt,2021 melakukan penelitian mengembangkan metode kriptografi dengan menggunakan algoritma arnolds cat map dan henon map .,28,1,11,0.21428571428571427,0.5,0.02631578947368421
Kualifikasi_Rama Dian Syah.txt,teknik konfusi digunakan pada algoritma arnolds cat map dan teknik difusi digunakan pada algoritm a henon map.,29,1,12,0.0625,0.5526315789473685,0.0
Kualifikasi_Rama Dian Syah.txt,hasil penelitian membuktikan bahwa teknik konfusi dan difusi dapat memberikan keamanan yang baik pada metode kriptografi citra digital.,30,1,11,0.2,0.6052631578947368,0.02631578947368421
Kualifikasi_Rama Dian Syah.txt,peneliti shazia sabir dan kawan kawan sabir guleria 2021 melakukan penelitian mengembangkan metode kriptografi citra digital menggunakan algoritma arnolds cat map reality preserving two dimensional di screte fractional hertley transform dan random matrix affine cipher .,31,1,30,0.1724137931034483,0.6578947368421053,0.02631578947368421
Kualifikasi_Rama Dian Syah.txt,hasil penelitian yaitu metode diterapkan pada enkripsi citra digital dengan multi layer warna komponen rgb.,32,1,12,0.11764705882352941,0.7105263157894737,0.02631578947368421
Kualifikasi_Rama Dian Syah.txt,peneliti arwa benlashram dan kawan kawan benlashram et al.,33,1,8,0.0,0.7631578947368421,0.0
Kualifikasi_Rama Dian Syah.txt,2020 melakukan penelitian mengembangkan metode kriptografi citra digital menggunakan metode pengacakan piksel dan 3d chaotic map .,34,1,13,0.46153846153846156,0.8157894736842105,0.02631578947368421
Kualifikasi_Rama Dian Syah.txt,hasil penelitian menunjukkan performa ke amanan dengan menggunakan parameter nilai korelasi 6 entropi npcr number of pixel change rate dan uaci unif ied average change intensity .,35,1,21,0.0,0.868421052631579,0.02631578947368421
Kualifikasi_Rama Dian Syah.txt,dari uraian diatas dapat disimpulkan bahwa metode kriptografi citra digital berbasis chaotic dapat dikembangkan untuk meningkatkan pe rforma keamanan.,36,1,14,0.4,0.9210526315789473,0.02631578947368421
Kualifikasi_Rama Dian Syah.txt,penelitian ini mengusulkan pengembangan metode kriptografi citra digital dengan menggunakan kombinasi dari cat map henon map dan logistic map menggunakan teknik konfusi dan difusi agar proses kripto grafi dapat meningkatkan keamanan dengan melalui beberapa pengujian.,37,1,23,0.21739130434782608,0.9736842105263158,0.02631578947368421
Kualifikasi_Remigius.txt,di era teknologi informasi dan komunikasi modern saat ini dunia fisik dan dunia digital semakin menyatu dan bertransformasi menjadi dunia visual di mana para anggota komunitas dari dunia terpadu ini dapat saling berinteraksi satu sama lain.,0,1,19,0.04,0.9761904761904762,0.0
Kualifikasi_Remigius.txt,inilah dunia y ang saat ini mulai dikenal sebagai metaverse zhao jiang chen liu yang xue chen 2022. istilah metaverse berasal dari kata majemuk meta dan universe yang berarti dunia baru yang mentransendensi realitas sebagai dunia virtual yang bekerja pintar smart dalam memenuhi harapan pengguna.,1,1,28,0.030303030303030304,0.9285714285714286,0.0
Kualifikasi_Remigius.txt,istilah ini pertama kali diperkenalkan oleh neal s tephenson pada 1992 yang mengacu pada makna keterlibatan komunitas yang mendalam dan realitas virtual alternatif sebagai semesta yang terhubung ke dalam jeja ring internet menjadi realitas visual zhao et al .,2,1,25,0.0625,0.8809523809523809,0.0
Kualifikasi_Remigius.txt,2022. akan tetapi fiksi berbasis teknologi multimedia memerlukan eksplorasi lebih lanjut dan metaverse perlu mampu menyediakan pengalaman yang jauh lebih realistis dan aktivitas yang kaya kepada pengguna yang memerlukan teknologi jauh lebih maju untuk mendukung konstruksi metaverse berbasis keterlibatan komunitas community engagement dan berorientasi pengguna useroriented .,3,1,26,0.14285714285714285,0.8333333333333334,0.0
Kualifikasi_Remigius.txt,perkembangan metaverse saat ini masih berada pada tahap awal kerangka konst ruksi visual nya masih kurang dan memerlukan proses eksplorasi baik terkait grafik interaksi maupun teknik visualisasi nya yang mendukung konstruksi visual metaverse khususnya berbasis keterlibatan komunitas dan berorientasi pengguna.,4,1,25,0.18518518518518517,0.7857142857142857,0.023809523809523808
Kualifikasi_Remigius.txt,di dalam metaverse beberapa elemen idealnya terlibat dalam teknologi metaverse terutama tugas interaksi aksi pengguna umpan balik dan berbagai saluran sensor yang membentuk konstruksi metaverse sebagai dunia visual yang berbasis integrasi dunia fisik dan dunia digital zhao et al.,5,1,27,0.1,0.7380952380952381,0.0
Kualifikasi_Remigius.txt,2022 .,6,1,0,0.0,0.6904761904761905,0.0
Kualifikasi_Remigius.txt,semua elemen ini diperlukan untuk mengembangkan potensi aplikasi di banyak bidang termasuk 2 dalam pembelajaran matakuliah di jurusan teknik arsitektur dan lebih spesifik pada mata kuliah perkembangan arsitektur.,7,1,16,0.14285714285714285,0.6428571428571429,0.023809523809523808
Kualifikasi_Remigius.txt,petrigna dan musumeci 2022 mengemukakan bahwa penerapan teknologi m etaverse bertujuan untuk membentuk jejaring terintegrasi antara dunia fisik dan dunia digital menjadi dunia visual di mana semua pengguna dalam komunitas saling terhubung dan berinteraksi melalui jaringan virt ual.,8,1,25,0.03125,0.5952380952380952,0.0
Kualifikasi_Remigius.txt,masalahnya adalah penerapan teknologi metaverse potensial bermasalah jika jaringan siber yang dipakai mudah putus dan sering mengalami gangguan.,9,1,12,0.047619047619047616,0.5476190476190477,0.0
Kualifikasi_Remigius.txt,dalam kasus ini kinerja teknologi metaverse cenderung rendah apabila jaringan siber lambat khususnya di lingkungan di mana komunitas pengguna masih menggunakan jaringan generasi lama seperti 3g bukan 4g.,10,1,15,0.09090909090909091,0.5,0.0
Kualifikasi_Remigius.txt,artinya penerapan teknologi metaverse dapat lebih efektif dalam komunitas di mana para pengguna sudah menikmati layanan akses internet yang d iperluas yang memungkinkan mendalamnya keterlibatan komunitas dalam dunia fisik dan dunia virtual.,11,1,19,0.125,0.4523809523809524,0.0
Kualifikasi_Remigius.txt,teknologi metaverse diterapkan melalui aplikasi populer di dalam realitas augmentasi augmented reality ar dan realitas virtual virtual reality vr dan yang dikembangkan untuk menghadirkan keterlibatan komunitas mendalam yang terhubung secara digital melalui pengalaman pengguna melalui koneksi sosial ke metaverse dalam pembelajaran perkembangan arsitektur .,12,1,30,0.20689655172413793,0.40476190476190477,0.023809523809523808
Kualifikasi_Remigius.txt,selain itu penerapan teknologi metaverse juga te rancam akan mengalami masalah keamanan basis data server dan privasi data khususnya berkaitan dengan pembajakan sinyal gelombang otak ekspresi wajah gerakan mata atau tangan dan keterlibatan komunitas lingkungan.,13,1,25,0.0967741935483871,0.35714285714285715,0.0
Kualifikasi_Remigius.txt,para penyerang hacker dapat menyerang dan mengontrol perangkat realitas augmentasi dan realitas virtual untuk melacak lokasi pengguna fitur biometrik serta identitas pengguna yang mengancam keselamatan manusia dan infrastruktur iot yang penting choi et al .,14,1,24,0.0,0.30952380952380953,0.0
Kualifikasi_Remigius.txt,2022. memperti mbangkan faktor keamanan tersebut alat pemantauan harus dikembangkan untuk menangani perilaku buruk pengguna dalam pembelajaran mengenai perkembangan arsitektur berbasis metaverse sementara metaverse juga memerlukan alat untuk mendorong perilaku pengguna yang positif.,15,1,23,0.21739130434782608,0.2619047619047619,0.023809523809523808
Kualifikasi_Remigius.txt,desain aplikasi sistem pembelajaran mengenai perkembangan arsitektur berbasis 3 metaverse perlu dipandu mengikuti tiga aspek yaitu privasi tata kelola dan pertimbangan etis.,16,1,17,0.2857142857142857,0.21428571428571427,0.023809523809523808
Kualifikasi_Remigius.txt,oleh karena itu diperlukan s olusi perlindungan keamanan pada sistem pembelajaran terkait perkembangan arsitektur berbasis metaverse khususnya manajemen identitas dan data klon avatar jejak digital kesadaran situasional serta kontrol konten buatan pengguna yang dibahas terkait persyaratan aplikasi untuk meningkatkan perilaku pengguna yang positif .,17,1,32,0.17647058823529413,0.16666666666666666,0.023809523809523808
Kualifikasi_Remigius.txt,dalam meningkatkan keterlibatan komunitas yang mendalam dalam sistem pembelajaran mengenai perkembangan arsitektur berbasis metaverse internet of things iot dimanfaatkan dengan memetakan data realtime dari realitas fisik ke dalam realitas digital di dunia virtual.,18,1,24,0.32,0.11904761904761904,0.023809523809523808
Kualifikasi_Remigius.txt,iot bisa melengkapi antar muka pengalaman pengguna dalam dunia virtual yang dibuat dengan realitas augmentasi dan realitas virtual yang memberikan konteks dan kesadaran situasional tentang hal hal fisik ke aplikasi arvr sambil memicu pertukaran data sebagai dasar untuk mengukur metrik dan kinerja metaverse dunia fisik dan digital.,19,1,28,0.030303030303030304,0.07142857142857142,0.0
Kualifikasi_Remigius.txt,perangkat ar misalnya dapat bereaksi terhadap gerakan j ari oleh pengguna atau memicu fungsi siberfisik yang didorong oleh peristiwa yang terjadi di dunia fisik.,20,0,14,0.0,0.023809523809523808,0.0
Kualifikasi_Remigius.txt,petrigna dan musumeci 2022 menjelaskan bahwa interaksi yang dibantu dengan iot membantu menciptakan cerminan digital digital twin dari keadaan fi sik dan keterlibatan komunitas .,21,1,16,0.09090909090909091,0.023809523809523808,0.023809523809523808
Kualifikasi_Remigius.txt,untuk itulah sistem pembelajaran mengenai perkembangan arsitektur 1 berbasis metaverse bertujuan memastikan refleksi sedekat mungkin dengan keadaan fisik realtime.,22,1,12,0.375,0.07142857142857142,0.023809523809523808
Kualifikasi_Remigius.txt,cerminan digital dapat dibangun untuk membuat pertemuan kelompok produktif di mana para pengguna dapat berinteraksi satu sama lain pada saat pembelajaran atau mendemonstrasikan replika prototipe perangkat keras atau lunak serta memakai representasi visual dalam menerapkan sistem pembelajaran terkait perkembangan arsitektur berbasis metaverse dengan melibatkan komunitas dan persepsi pengguna .,23,1,30,0.26666666666666666,0.11904761904761904,0.023809523809523808
Kualifikasi_Remigius.txt,dalam konteks itu sistem pembelajaran mengenai perkembangan arsitektur berbasis metaverse merupakan dunia virtual tiga dimensi berba sis internet di mana komunitas pengguna dapat melakukan aktivitas sehari hari menggunakan avatar yang mewakili diri nya sendiri yang nyata atau imajiner.,24,1,22,0.28,0.16666666666666666,0.023809523809523808
Kualifikasi_Remigius.txt,dengan kata lain ruang virtual menjadi dunia nyata alternatif di mana avatar atau 4 profil digital terlibat atau berpartisipasi dalam kegiatan pembelajaran secara virtual.,25,1,14,0.09523809523809523,0.21428571428571427,0.0
Kualifikasi_Remigius.txt,metaverse menjadi suatu platform yang memiliki teknologi dan struktur yang dapat dibagi menjadi kategori berbeda .,26,1,8,0.058823529411764705,0.2619047619047619,0.0
Kualifikasi_Remigius.txt,pertama realitas augmentasi augmented reality yang menambahkan secara realtime lingkungan grafis digital ke dunia yang ada fisik dan nyata dengan smartphone .,27,1,12,0.0,0.30952380952380953,0.0
Kualifikasi_Remigius.txt,dalam sistem pembelajaran terkait perkembangan arsitektur berbasis metaverse realitas ini menempatkan informasi lebih lanjut mengenai lingkungan nyata seperti anim asi tiga dimensi .,28,1,15,0.3157894736842105,0.35714285714285715,0.023809523809523808
Kualifikasi_Remigius.txt,kedua lifelogging sebagai augmentasi dari kata virtual di mana perangkat pintar diadopsi untuk merekam kehidupan sehari hari di internet seperti instagram facebook dan twitter .,29,1,13,0.0,0.40476190476190477,0.0
Kualifikasi_Remigius.txt,ketiga dunia cermin geografis geographical mirror world sebagai simulasi dunia nyata di mana penampilan informasi maupun struktur nyata ditransfer ke ruang virtual dan memungkinkan kegiatan lewat internet atau aplikasi seluler seperti google maps earth .,30,1,24,0.0,0.4523809523809524,0.0
Kualifikasi_Remigius.txt,keempat realitas virtual dan dunia campuran virtual reality and mixed reality di mana dunia fisik dan dunia digital terintegrasi ke dalam dunia visual kamel et al.,31,1,20,0.0,0.5,0.0
Kualifikasi_Remigius.txt,2008 .,32,1,0,0.0,0.5476190476190477,0.0
Kualifikasi_Remigius.txt,interaksi komunitas dalam metaverse menjadi pendorong banyak pengguna baru memasuki platform tersebut.,33,1,8,0.125,0.5952380952380952,0.0
Kualifikasi_Remigius.txt,secara umum metaverse mempunyai daya tarik yang dapat membangkitkan minat pengguna .,34,1,6,0.06666666666666667,0.6428571428571429,0.0
Kualifikasi_Remigius.txt,melalui interaksi real time pengguna dapat merasakan kehadiran serta keterlibatan digital di ruang yang mirip dengan kenyataan dan pengguna dapat merasakan aktivitas pengalaman virtual di temp at yang sulit dikunjungi.,35,1,19,0.038461538461538464,0.6904761904761905,0.0
Kualifikasi_Remigius.txt,selain itu metaverse memiliki elemen komunitas yang kuat di mana hubungan timbal balik terbentuk.,36,1,8,0.125,0.7380952380952381,0.0
Kualifikasi_Remigius.txt,pada saat jumlah pengguna meningkat jumlah kunjungan dan waktu penggunaan layanan juga dapat digabungka n. dengan keunggulan tersebut metaverse sedang diterapkan secara aktif di berbagai bidang dan lembaga pemerintah juga secara aktif meninjau pengenalan metaverse untuk meningkatkan minat dan partisipasi komunitas .,37,1,22,0.07692307692307693,0.7857142857142857,0.023809523809523808
Kualifikasi_Remigius.txt,dalam mengembang kan sistem pembelajaran perkembangan arsitektu r di perguruan tinggi berbasis metaverse keterlibatan komunitas dan persepsi pengguna perlu dipertimbangkan .,38,1,14,0.4375,0.8333333333333334,0.023809523809523808
Kualifikasi_Remigius.txt,atribut keterlibatan komunitas dapat dilihat dari 5 visualisasi dan pemodelan data interaksi sosial .,39,1,9,0.11764705882352941,0.8809523809523809,0.0
Kualifikasi_Remigius.txt,dari sisi teknologi keterlibatan komunitas dapat dibagi menjadi tiga model yaitu fixed model untuk mengembangkan data state model state model untuk menampilkan karakter postur dan gerakan terkini dan live model untuk membentuk interaksi di antara pengguna melalui pesan instan selain sebagai sistem peringatan yang memberikan nasehat bila muncul percakapan yang tidak pantas atau tidak etis.,40,1,32,0.12121212121212122,0.9285714285714286,0.023809523809523808
Kualifikasi_Remigius.txt,untuk meningkatkan keterlibatan komunitas penerapan teknologi metaverse perlu berorientasi pengguna useroriented .,41,1,9,0.1875,0.9761904761904762,0.023809523809523808
KUALIFIKASI_Riya Widayanti.txt,masalah perubahan teknologi dapat kita rasakan pada setiap zaman.,0,1,0,0.1,0.9642857142857143,0.0
KUALIFIKASI_Riya Widayanti.txt,perubahan teknologi menjadi semakin modern mempengaruhi kinerja dalam segala bidang seperti pendidikan kesehatan ekonomi dan segala bidang u. rahardja 2019. perubahan teknologi informasi dan komunikasi dilihat dari revolusi industri 1.0 ke 4.0 selalu melakukan perubahan setiap tahunnya seperti penggunaan teknologi yang lebih modern dan sesuai dengan kebutuhan manusia untuk beradaptasi dengan gaya hidup masa kini yang tidak pernah lepas dari yang namanya teknologi.,1,1,37,0.058823529411764705,0.8928571428571429,0.0
KUALIFIKASI_Riya Widayanti.txt,penelitian nasution.,2,1,0,0.0,0.8214285714285714,0.0
