nama_dokumen,kalimat,index,important,length,words_in_title,position,cue_words
Devi Resviani_KUALIFIKASI.txt,gambaran mengenai tahapan penelitian ini dapat dilihat pada gambar 3.1. studi literatur pengumpulan dan analisis data preprocessing data pemilihan algoritma yang efektif pengembangan model machine learning sistem peringatan pemeliharaan prediktif evaluasi identifikasi permasalahan integrasi model dengan sistem peringatan pemeliharaan prediktif gambar 3.1 tahapan penelitian gambar 3.1 menunjukkan tahapan penelitian sebagai dasar untuk pengembangan sistem pemeliharaan prediktif menggunakan teknik machine 45 learning.,78,1,52,0.05714285714285714,0.1056338028169014,0.007042253521126761
Devi Resviani_KUALIFIKASI.txt,tahapan penelitian ini terdiri dari studi literatur untuk memahami keadaan yang terfokus terhadap tentang mesin kompresor reciprocating metode prediksi pemeliharaan mesin predictive maintenance dan machine learning.,79,1,17,0.4117647058823529,0.11971830985915492,0.0
Devi Resviani_KUALIFIKASI.txt,identifikasi permasalahan secara spesifik yang akan diatasi oleh penelitian termasuk mendefinisikan ruang lingkup serta tujuan dari penelitian.,80,1,10,0.0,0.13380281690140844,0.0
Devi Resviani_KUALIFIKASI.txt,pengumpulan data yang relevan dan melakukan analisis awal untuk memahami karakteristik dan pola dalam data.,81,1,8,0.0,0.14788732394366197,0.0
Devi Resviani_KUALIFIKASI.txt,p reprocessing data melibatkan pembersihan data normalisasi dan transformasi data agar siap digunakan dalam model machine learning.,82,1,12,0.125,0.1619718309859155,0.0
Devi Resviani_KUALIFIKASI.txt,tahap ini bertujuan untuk mengatasi masalah data yang hilang outliers dan memastikan data berada dalam format yang sesuai.,83,1,9,0.0,0.176056338028169,0.0
Devi Resviani_KUALIFIKASI.txt,p emilihan algoritma machine learning yang efektif untuk membantu mencapai akurasi yang lebih tinggi dan efisiensi dalam prediksi.,84,1,11,0.11764705882352941,0.19014084507042253,0.0
Devi Resviani_KUALIFIKASI.txt,p engembangan dan melatih model machine learning menggunakan algoritma yang telah dipilih dengan data yang telah diperoses tahap ini melibatkan pembagian data menjadi set pelatihan dan set pengujian serta termasuk mengatur parameter model untuk mencapai kinerja terbaik.,85,1,24,0.07692307692307693,0.20422535211267606,0.0
Devi Resviani_KUALIFIKASI.txt,s istem peringatan pemeliharaan prediktif menggunakan model machine learning untuk memprediksi kegagalan mesin sistem ini bertujuan untuk memberikan peringatan dini sebelum terjadinya kerusakan atau kegagalan mesin.,86,1,17,0.15789473684210525,0.21830985915492956,0.0
Devi Resviani_KUALIFIKASI.txt,i ntegrasi model dengan sistem peringatan pemeliharaan prediktif tahap ini memastikan bahwa model dapat bekerja secara realtime dan memberikan peringatan yang akurat kepada pengguna.,87,1,13,0.0,0.2323943661971831,0.0
Devi Resviani_KUALIFIKASI.txt,serta tahapan terakhir adalah evaluasi kinerja sistem secara keseluruhan untuk memastikan bahwa sistem peringatan pemeliharaan prediktif berfungsi dengan baik dan mencapai tujuan yang diinginkan.,88,1,12,0.0,0.24647887323943662,0.0
Devi Resviani_KUALIFIKASI.txt,3.2 pengumpulan dan analisis data observasi data dilakukan pada platform terpercaya yang menyediakan berbagai dataset publik yaitu kaggle .,89,1,13,0.0,0.2605633802816901,0.0
Devi Resviani_KUALIFIKASI.txt,data yang digunakan yaitu dataset mesin kompresor reciprocating yang divisualisasikan oleh akun kaggle bernama ahmet okudan.,90,1,11,0.1875,0.2746478873239437,0.0
Devi Resviani_KUALIFIKASI.txt,dataset tersebut berisi data operasional dari mesin kompresor reciprocating dengan total 1000 sampel.,91,1,10,0.2,0.2887323943661972,0.0
Devi Resviani_KUALIFIKASI.txt,setiap sampel dalam dataset tersebut mencakup 26 kolom yang berisi informasi dapat dilihat pada tabel 3.1. 46 tabel 3.1 deskripsi kolom dataset mesin kompresor reciprocating no nama kolom deskripsi 1.,92,1,25,0.13636363636363635,0.3028169014084507,0.0
Devi Resviani_KUALIFIKASI.txt,id identifikasi unik untuk setiap entri 2.,93,1,0,0.0,0.31690140845070425,0.0
Devi Resviani_KUALIFIKASI.txt,rpm kecepatan putaran mesin dalam rotasi per menit 3.,94,1,7,0.07142857142857142,0.33098591549295775,0.0
Devi Resviani_KUALIFIKASI.txt,motor power daya motor dalam watt 4.,95,1,6,0.0,0.34507042253521125,0.0
Devi Resviani_KUALIFIKASI.txt,torque torsi yang dihasilkan oleh mesin 5.,96,1,0,0.08333333333333333,0.3591549295774648,0.007042253521126761
Devi Resviani_KUALIFIKASI.txt,outlet pressure bar tekanan keluaran dalam bar 6.,97,1,7,0.0,0.3732394366197183,0.0
Devi Resviani_KUALIFIKASI.txt,air flow aliran udara yang diukur 7.,98,1,6,0.0,0.3873239436619718,0.0
Devi Resviani_KUALIFIKASI.txt,noise db tingkat kebisingan dalam desibel 8.,99,1,6,0.0,0.4014084507042254,0.007042253521126761
Devi Resviani_KUALIFIKASI.txt,outlet temperature suhu keluaran 9.,100,1,0,0.0,0.4154929577464789,0.0
Devi Resviani_KUALIFIKASI.txt,water pump outlet pressure tekanan keluaran pompa air 10.,101,1,9,0.0,0.4295774647887324,0.0
Devi Resviani_KUALIFIKASI.txt,water inlet temperature suhu air masuk 11.,102,1,7,0.0,0.44366197183098594,0.0
Devi Resviani_KUALIFIKASI.txt,water outlet temperature suhu air keluar 12.,103,1,6,0.0,0.45774647887323944,0.0
Devi Resviani_KUALIFIKASI.txt,water pump power daya pompa air 13.,104,1,7,0.0,0.47183098591549294,0.0
Devi Resviani_KUALIFIKASI.txt,water flow aliran air 14.,105,1,0,0.0,0.4859154929577465,0.0
Devi Resviani_KUALIFIKASI.txt,oil pump power daya pompa oli 15.,106,1,7,0.0,0.5,0.0
Devi Resviani_KUALIFIKASI.txt,oil tank temperature suhu tangki oli 16.,107,1,7,0.0,0.5140845070422535,0.0
Devi Resviani_KUALIFIKASI.txt,gacceleration x gaccx akselerasi gravitasi pada sumbu x 17.,108,1,8,0.0,0.528169014084507,0.0
Devi Resviani_KUALIFIKASI.txt,gacceleration y gaccy akselerasi gravitasi pada sumbu y 18.,109,1,8,0.0,0.5422535211267606,0.0
Devi Resviani_KUALIFIKASI.txt,gacceleration z gaccz akselerasi gravitasi pada sumbu z 19.,110,1,8,0.0,0.5563380281690141,0.0
Devi Resviani_KUALIFIKASI.txt,hacceleration x haccx akselerasi horizontal pada sumbu x 20.,111,1,8,0.0,0.5704225352112676,0.0
Devi Resviani_KUALIFIKASI.txt,hacceleration y haccy akselerasi horizontal pada sumbu y 21.,112,1,8,0.0,0.5845070422535211,0.0
Devi Resviani_KUALIFIKASI.txt,hacceleration z haccz akselerasi horizontal pada sumbu z 22.,113,1,8,0.0,0.5985915492957746,0.0
Devi Resviani_KUALIFIKASI.txt,bearings kondisi bearing misalnya ok 23.,114,0,0,0.0,0.6126760563380281,0.0
Devi Resviani_KUALIFIKASI.txt,water pump kondisi pompa air misalnya ok 24.,115,0,7,0.0,0.6267605633802817,0.0
Devi Resviani_KUALIFIKASI.txt,radiator kondisi radiator misalnya clean 25.,116,0,0,0.0,0.6408450704225352,0.0
Devi Resviani_KUALIFIKASI.txt,exvalve kondisi katup eksvalve misalnya clean 26.,117,0,6,0.0,0.6549295774647887,0.0
Devi Resviani_KUALIFIKASI.txt,ac motor kondisi motor ac misalnya stable analisis data penelitian ini menggunakan metode exploratory data analysis eda bertujuan untuk memberikan gambaran umum tentang data dan mengidentifikasi pola atau anomali yang mungkin tidak terlihat dengan metode lain.,118,0,22,0.0,0.6690140845070423,0.0
Devi Resviani_KUALIFIKASI.txt,penerapan metode eda dalam dataset mesin kompresor reciprocating menggunakan software python open access di notebook jupyter gambaran mengenai alur proses analisis data dapat dilihat pada gambar 3.2. 47 visualisasi data impor dataset identifikasi outlier analisis korelasi antar variabel statistik deskriptif impor library informasi dataset gambar 3.2 alur proses analisis data gambar 3.2 menggambarkan alur proses analisis data dengan tahap pertama adalah mengimpor library atau pustaka yang diperlukan untuk analisis data.,119,1,58,0.07894736842105263,0.6830985915492958,0.0
Devi Resviani_KUALIFIKASI.txt,tahap selanjutnya adalah mengimpor dataset yang akan dianalisis.,120,1,0,0.0,0.6971830985915493,0.0
Devi Resviani_KUALIFIKASI.txt,tahap berikutnya adalah memeriksa informasi dasar tentang dataset untuk memahami struktur dan isi data.,121,1,9,0.0,0.7112676056338029,0.0
Devi Resviani_KUALIFIKASI.txt,tahap ini termasuk melihat beberapa baris pertama dataset tipe data setiap kolom dan jumlah data.,122,1,7,0.0,0.7253521126760564,0.0
Devi Resviani_KUALIFIKASI.txt,tahap selanjutnya statistik deskriptif untuk memahami distribusi data seperti mean median mode standard deviation dan range .,123,1,12,0.0,0.7394366197183099,0.0
Devi Resviani_KUALIFIKASI.txt,tahap berikutnya identifikasi outlier atau nilai yang jauh berbeda dari data lainnya.,124,1,7,0.0,0.7535211267605634,0.0
Devi Resviani_KUALIFIKASI.txt,outlier dapat mempengaruhi analisis dan model sehingga perlu diperiksa apakah akan dihapus atau ditangani dengan cara lain.,125,1,8,0.0,0.7676056338028169,0.0
Devi Resviani_KUALIFIKASI.txt,tahap selanjutnya analisis korelasi dilakukan untuk melihat hubungan antara variabel variabel dalam dataset.,126,1,7,0.0,0.7816901408450704,0.0
Devi Resviani_KUALIFIKASI.txt,korelasi membantu memahami bagaimana satu variabel mungkin mempengaruhi variabel lain.,127,1,7,0.0,0.795774647887324,0.0
Devi Resviani_KUALIFIKASI.txt,tahap terakhir visualisasi data menggunakan berbagai jenis grafik seperti histogram scatter plot dan box plot untuk lebih memahami distribusi dan pola dalam data.,128,1,14,0.0,0.8098591549295775,0.0
Devi Resviani_KUALIFIKASI.txt,3.3 preprocessing data preprocessing data sangat penting untuk memastikan bahwa data yang digunakan untuk pelatihan model machine learning memiliki kualitas yang tinggi relevan dan sesuai.,129,1,15,0.11764705882352941,0.823943661971831,0.0
Devi Resviani_KUALIFIKASI.txt,alur proses data preprocessing pada penelitian ini dapat dilihat pada gambar 3.3. imputasi transformasi data reduksi dimensi gambar 3.3 alur proses data preprocessing 48 gambar 3.3 menunjukkan alur proses data preprocessing terdiri dari tahap pertama imputasi dilakukan untuk mengganti nilai yang outlier dengan nilai yang lebih representative.,130,1,35,0.0,0.8380281690140845,0.0
Devi Resviani_KUALIFIKASI.txt,tahap kedua transformasi data untuk memperbaiki distribusi yang tidak normal.,131,1,6,0.0,0.852112676056338,0.0
Devi Resviani_KUALIFIKASI.txt,tahap ketiga reduksi dimensi yaitu mengurangi jumlah fitur dalam dataset guna menangani dataset dengan banyak fitur mengurangi kompleksitas model dan mencegah overfitting.,132,1,15,0.0,0.8661971830985915,0.0
Devi Resviani_KUALIFIKASI.txt,3.4 sistem peringatan pemeliharaan prediktif sistem peringatan pemeliharaan prediktif adalah sistem yang menggunakan teknik teknik analisis data terutama machine learning untuk memantau kondisi mesin dan memprediksi kegagalan yang mungkin terjadi.,133,1,23,0.13636363636363635,0.8802816901408451,0.0
Devi Resviani_KUALIFIKASI.txt,penelitian ini mengusulkan sistem untuk memberikan peringatan dini kepada operator atau tim pemeliharaan sehingga tindakan preventif dapat dilakukan sebelum kegagalan terjadi mengurangi downtime dan biaya pemeliharaan.,134,1,14,0.0,0.8943661971830986,0.0
Devi Resviani_KUALIFIKASI.txt,gambaran alur kerja usulan sistem peringatan pemeliharaan prediktif dapat dilihat pada gambar 3.4. monitoring data realtime input data ke model prediksideteksi anomalianalisis prediksialert jadwal pemeliharaan gambar 3.4 alur kerja sistem peringatan pemeliharaan prediktif gambar 3.4 menggambarkan alur kerja dari sistem pemeliharaan prediktif pada mesin kompresor reciprocating berbasis machine learning.,135,1,46,0.2222222222222222,0.9084507042253521,0.0
Devi Resviani_KUALIFIKASI.txt,tahap awal adalah data operasional mesin dikumpulkan secara menerus menggunakan sensor bertujuan memastikan data terkini tersedia untuk dianalisis guna mendeteksi 49 tanda tanda awal kegagalan mesin.,136,1,18,0.045454545454545456,0.9225352112676056,0.0
Devi Resviani_KUALIFIKASI.txt,tahap kedua menginput data dari pemantauan realtime ke dalam model prediksi pemeliharaan yang telah dilatih.,137,1,9,0.0,0.9366197183098591,0.0
Devi Resviani_KUALIFIKASI.txt,tahap ketiga mendeteksi adanya anomali atau pola yang tidak biasa agar tindakan pencegahan dapat diambil sebelum kerusakan terjadi.,138,1,10,0.0,0.9507042253521126,0.0
Devi Resviani_KUALIFIKASI.txt,tahap keempat analisis prediksi untuk memperkirakan kapan dan bagaimana kegagalan akan terjadi sehingga pemeliharaan dapat direncanakan dengan tepat.,139,1,8,0.0,0.9647887323943662,0.0
Devi Resviani_KUALIFIKASI.txt,tahap kelima alert atau peringatan untuk memberikan informasi kepada tim pemeliharaan agar dapat segera mengambil tindakan.,140,1,8,0.0,0.9788732394366197,0.0
Devi Resviani_KUALIFIKASI.txt,tahap terakhir menjadwalkan tindakan pemeliharaan yang diperlukan berdasarkan peringatan untuk menghindari kegagalan mendadak dan meminimalkan downtime.,141,1,11,0.0,0.9929577464788732,0.0
Erfiana Wahyuningsih_UK.txt,berdasarkan beberapa penelitian terkait sram untuk mewujudkan sram low power dan high read stability metode yang dapat dilakukan yakni gdi mgdi finfet cntfet hingga adiabatik.,0,1,17,0.28,0.9655172413793104,0.034482758620689655
Erfiana Wahyuningsih_UK.txt,namun yang akan menjadi focus utama penelitian ini yakni penerapan dari metode mgdi modified gate diffusion input.,1,1,10,0.0,0.896551724137931,0.0
Erfiana Wahyuningsih_UK.txt,desain sel m gdi memanfaatkan input untuk bertindak sebagai sumber dan penyimpan untuk transistor mos yang mengurangi komponen konsumsi daya short circuit dinamis menjadi nilai yang dapat diabaikan tanpa memerlukan pertimbangan desain sirkuit khusus.,2,1,24,0.05405405405405406,0.8275862068965517,0.0
Erfiana Wahyuningsih_UK.txt,oleh karena itu dipilih metode m gdi sebab metode ini menawarkan solusi yang lebih efisien dalam hal konsumsi daya dan kompleksitas desain yang sangat penting dalam pengembangan sirkuit digital yang hemat energi dan efisien 8.,3,1,19,0.06451612903225806,0.7586206896551724,0.034482758620689655
Erfiana Wahyuningsih_UK.txt,2.4 rangkuman penelitian .,4,1,0,0.0,0.6896551724137931,0.0
Erfiana Wahyuningsih_UK.txt,"metodepenelitian
untuk mempermudah dalam melakukan penelitian maka dibuat sebuah flowchart agar penelitian tidak menyimpang dan salah.",5,1,7,0.0,0.6206896551724138,0.0
Erfiana Wahyuningsih_UK.txt,berikut flowchart penelitian untuk rangkaian sram 6t low power dan high read stability dengan metode m gdi.,6,1,13,0.45,0.5517241379310345,0.0
Erfiana Wahyuningsih_UK.txt,gambar 10.,7,1,0,0.0,0.4827586206896552,0.0
Erfiana Wahyuningsih_UK.txt,alur penelitian sram 6t dengan metode m gdi dalam me mulai desain sram 6t dengan menggunakan metode m gdi diperlukan studi literatur terkait bebera pa penelitian dengan metode atau hasil serupa .,8,1,22,0.14814814814814814,0.41379310344827586,0.034482758620689655
Erfiana Wahyuningsih_UK.txt,setelah me mpelajari se luruh penelitian terkait maka di lakukan desain rangkaian sram dengan metode konvensional sebagai referensi untuk dilakukan proses m gdi.,9,1,15,0.10714285714285714,0.3448275862068966,0.0
Erfiana Wahyuningsih_UK.txt,referensi rangkaian diperlukan untuk melihat hasil sebagai pembanding dengan rangkaian baru yang didesain dengan metode mgdi.,10,1,8,0.0,0.27586206896551724,0.034482758620689655
Erfiana Wahyuningsih_UK.txt,dipilih desain berdasarkan penelitian sebelumnya yang dilakukan oleh ebrahim abiri dan abdolreza darabi 2015 sram 8t dengan low power dan high read stability menggunakan metode m gdi.,11,1,19,0.2962962962962963,0.20689655172413793,0.0
Erfiana Wahyuningsih_UK.txt,berdasarkan penelit ian yang dilakukan rangkaian sram ini terbagi menjadi 3 blok yakni write bloc k sram 8t block dan read bloc k seperti pada gambar 11 be rikut gambar 11.,12,1,23,0.0625,0.13793103448275862,0.0
Erfiana Wahyuningsih_UK.txt,desain sram 8t dengan metode m gdi lengkap gambar 11 akan dijadikan referensi untuk dilakukan tahap m gdi selanjutnya guna mendapatkan desain baru dengan kemampuan low power da n high read stability.,13,1,23,0.2857142857142857,0.06896551724137931,0.0
Erfiana Wahyuningsih_UK.txt,penelitian tetap akan memusatkan pada desain rang kaian sram 8t untuk direduksi menjadi 6t dengan metode mgdi.,14,1,11,0.08,0.0,0.0
Erfiana Wahyuningsih_UK.txt,hasil yang dihar apkan tetap mengacu pada low power dan mempertaha nkan pula kemampuan high read stability.,15,1,12,0.21739130434782608,0.06896551724137931,0.034482758620689655
Erfiana Wahyuningsih_UK.txt,rangkaian sram 8t diatas memiliki hasil simulasi seperti yang tamp ak pada gambar 12.,16,1,11,0.038461538461538464,0.13793103448275862,0.034482758620689655
Erfiana Wahyuningsih_UK.txt,gambar 12.,17,1,0,0.0,0.20689655172413793,0.0
Erfiana Wahyuningsih_UK.txt,simulasi sinyal masukan dan keluar an sram 8t dalam kondisi menulis write proses write pada rangkaian sram 8t dimulai ketika word line wl mencapai tegangan tinggi yang menyebabkan transistor akses access transistors menjadi aktif on.,18,1,26,0.02631578947368421,0.27586206896551724,0.0
Erfiana Wahyuningsih_UK.txt,pada saat itu data disimpan dengan cepat pada node q dan qb yang terhubung ke gerbang da ri transistor pusat sel enr dan enl.,19,1,15,0.0,0.3448275862068966,0.0
Erfiana Wahyuningsih_UK.txt,setelah itu data mencapai keadaan permanen dengan bantuan sel sel m gdi .,20,1,8,0.09523809523809523,0.41379310344827586,0.0
Erfiana Wahyuningsih_UK.txt,selama siklus write sel m gdi berperan dalam memastikan bahwa data yang ditulis ke dalam sel memori sram disimpan dengan stabil dan cepat yang merupakan bagian penting dari desain sram low power gambar 1 3.,21,1,21,0.16666666666666666,0.4827586206896552,0.0
Erfiana Wahyuningsih_UK.txt,simulasi sinyal masukan dan keluar an hanya pada rangkaian blok sram 8t dalam blok rangkaian sram 8t input utama termasuk word line wl bit lines bl dan blb dan sinyal sinyal kontrol untuk operasi pembacaan dan penulisan.,22,1,27,0.027777777777777776,0.5517241379310345,0.0
Erfiana Wahyuningsih_UK.txt,output dari rangkaian ini adalah data yang dibaca dari sel memori d_out dan d_outb .,23,1,10,0.0,0.6206896551724138,0.0
Erfiana Wahyuningsih_UK.txt,ketika melakukan operasi penulisan data yang akan ditulis ke dalam sel memori disuplai melalui bit lines bl dan blb.,24,1,11,0.0,0.6896551724137931,0.0
Erfiana Wahyuningsih_UK.txt,sinyal wl diaktifkan untuk menghubungkan sel memori dengan bit lines memungkinkan data untuk ditransfer ke dalam sel.,25,1,11,0.0,0.7586206896551724,0.0
Erfiana Wahyuningsih_UK.txt,setelah data ditu lis wl dinonaktifkan untuk mengisolasi sel dari bit lines dan menjaga data yang telah disimpan .,26,1,12,0.0,0.8275862068965517,0.0
Erfiana Wahyuningsih_UK.txt,selama operasi pembacaan wl diaktifkan untuk menghubungkan sel memori dengan bit lines memungkinkan data yang tersimpan di dalam sel untuk ditransfer keluar.,27,1,14,0.0,0.896551724137931,0.0
Erfiana Wahyuningsih_UK.txt,data yang dibaca kemudian muncul pada output d_out dan d_outb dengan swing tegangan maksimum pad a output inverter .,28,1,15,0.0,0.9655172413793104,0.0
Robert_Kualifikasi.txt,tidak ada rangkuman penelitian terkait.,1,1,0,0.0,1,0.0
Tatya Atyanti Paramastri_Kualifikasi.txt,berdasarkan penelitian di atas permasalahan pada klasifikasi batik biasanya berasal dari dataset yang kurang mendukung.,0,1,8,0.11764705882352941,0.9090909090909091,0.0
Tatya Atyanti Paramastri_Kualifikasi.txt,selain itu warna citra rgb bukanlah faktor penting pada klasifikasi motif batik pada daerah tertentu yang memiliki warna seragam.,1,1,11,0.23529411764705882,0.7272727272727273,0.0
Tatya Atyanti Paramastri_Kualifikasi.txt,selanjutnya deteksi tepi dilakukan untuk meningkatkan akurasi.,2,1,0,0.0,0.5454545454545454,0.09090909090909091
Tatya Atyanti Paramastri_Kualifikasi.txt,namun karena deteksi tepi membuat citra menjadi grayscale maka sebaiknya hanya dilakukan pada klasifikasi motif batik dari satu daerah.,3,1,8,0.26666666666666666,0.36363636363636365,0.0
Tatya Atyanti Paramastri_Kualifikasi.txt,berdasarkan penelitian tersebut klasifikasi citra berbasis kuantum dapat dilakukan dengan menggunakan komputer pribadi baik komputer klasik atau terhubung dengan komputer kuantum.,4,1,13,0.16666666666666666,0.18181818181818182,0.0
Tatya Atyanti Paramastri_Kualifikasi.txt,kedua pilihan tersebut memiliki kelebihan dan kekurangannya masingmasing.,5,1,0,0.0,0.0,0.0
Tatya Atyanti Paramastri_Kualifikasi.txt,masalah yang masih dihadapi oleh penggunaan komputasi kuantum saat ini adalah kecepatan maka dari itu banyak jurnal yang mengabaikan kompleksitas waktu.,6,1,9,0.05263157894736842,0.18181818181818182,0.0
Tatya Atyanti Paramastri_Kualifikasi.txt,selain itu untuk menyesuaikan dengan kemampuan perangkat yang digunakan citra yang akan diproses harus mengalami downscaling dan dataset yang digunakan tidak dapat dalam jumlah yang sangat besar.,7,1,9,0.05263157894736842,0.36363636363636365,0.0
Tatya Atyanti Paramastri_Kualifikasi.txt,berdasarkan penelitian didapatkan hasil bahwa deteksi tepi canny memberikan hasil yang lebih baik dibandingkan sobel prewitt robert.,8,1,12,0.0,0.5454545454545454,0.09090909090909091
Tatya Atyanti Paramastri_Kualifikasi.txt,hal ini dikarenakan operator canny mempunyai beberapa tahap deteksi tepi yang tidak dimiliki oleh operator lain sehingga dapat menghasilkan tepi yang lebih jelas.,9,1,10,0.0,0.7272727272727273,0.09090909090909091
Tatya Atyanti Paramastri_Kualifikasi.txt,penerapan komputasi kuantum pada detekti tepi terbukti dapat menghasilkan deteksi tepi yang lebih baik dibandingkan dengan deteksi tepi canny klasik dengan mendeteksi lebih banyak tepi dibandingkan deteksi tepi klasik berdasarkan jumlah tepi yang dihasilkan.,10,1,23,0.045454545454545456,0.9090909090909091,0.09090909090909091
Tia Haryanti_Kualifikasi.txt,berdasarkan penelitian penelitian dalam tabel di atas menjelaskan mengenai peran dari teknologi artificial intelligence dalam mengembangkan solusi yang canggih untuk mengidentifikasi kelelahan pada pengemudi.,0,1,14,0.16666666666666666,0.9787234042553191,0.02127659574468085
Tia Haryanti_Kualifikasi.txt,melalui pemrosesan visual secara mendalam dan pemahaman pola teknologi tersebut mampu 40 mendeteksi tanda tanda kelelahan pada area mata mulut dan kepala pengemudi dengan tingkat akurasi yang semakin tinggi.,1,1,19,0.08333333333333333,0.9361702127659575,0.02127659574468085
Tia Haryanti_Kualifikasi.txt,studi diatas menunjukkan bahwa terdapat potensi d alam meningkatkan keselamatan di jalan raya melalui pendekatan berbasis teknologi yang cerdas dan efektif.,2,1,14,0.0,0.8936170212765957,0.02127659574468085
Tia Haryanti_Kualifikasi.txt,penelitian penelitian sejenis yang merupakan peneltian terdahulu antara lain implementasi pemanfaatan kecerdasan buatan dalam bidang teknologi infor masi untuk mendeteksi kelelahan seperti pada tahun 2019 dengan mengusulkan sistem pengenalan aktivitas pengemudi berbasis deep learning dengan akurasi 932 untuk mengenali pengemudi menjawab telepon dan 945 mengirim pesan xing y.,3,1,33,0.08333333333333333,0.851063829787234,0.02127659574468085
Tia Haryanti_Kualifikasi.txt,lv c.,4,1,0,0.0,0.8085106382978723,0.0
Tia Haryanti_Kualifikasi.txt,wang h.,5,1,0,0.0,0.7659574468085106,0.0
Tia Haryanti_Kualifikasi.txt,ca o d.,6,1,0,0.0,0.723404255319149,0.0
Tia Haryanti_Kualifikasi.txt,velenis e.,7,1,0,0.0,0.6808510638297872,0.0
Tia Haryanti_Kualifikasi.txt,wang f.,8,1,0,0.0,0.6382978723404256,0.0
Tia Haryanti_Kualifikasi.txt,y.,9,1,0,0.0,0.5957446808510638,0.0
Tia Haryanti_Kualifikasi.txt,2019.,10,1,0,0.0,0.5531914893617021,0.0
Tia Haryanti_Kualifikasi.txt,pada tahun 2020 terdapat dua penelitian yang mengusulkan deteksi kelelahan berbasis multi fitur wajah untuk meningkatkan akurasi deteksi.,11,1,12,0.05555555555555555,0.5106382978723404,0.02127659574468085
Tia Haryanti_Kualifikasi.txt,algoritma yang digunakan yaitu yolov3 tiny dengan akurasi 9510 li k.,12,1,7,0.0,0.46808510638297873,0.0
Tia Haryanti_Kualifikasi.txt,go ng y.,13,1,0,0.0,0.425531914893617,0.0
Tia Haryanti_Kualifikasi.txt,ren z.,14,1,0,0.0,0.3829787234042553,0.0
Tia Haryanti_Kualifikasi.txt,2020.,15,1,0,0.0,0.3404255319148936,0.0
Tia Haryanti_Kualifikasi.txt,serta penggunaan algoritma em cnn dengan akurasi 97913 zhao z.,16,1,8,0.0,0.2978723404255319,0.0
Tia Haryanti_Kualifikasi.txt,zhou n.,17,1,0,0.0,0.2553191489361702,0.0
Tia Haryanti_Kualifikasi.txt,zhang l.,18,1,0,0.0,0.2127659574468085,0.0
Tia Haryanti_Kualifikasi.txt,yan h.,19,1,0,0.0,0.1702127659574468,0.0
Tia Haryanti_Kualifikasi.txt,xu y.,20,1,0,0.0,0.1276595744680851,0.0
Tia Haryanti_Kualifikasi.txt,zhang z.,21,1,0,0.0,0.0851063829787234,0.0
Tia Haryanti_Kualifikasi.txt,2020.,22,1,0,0.0,0.0425531914893617,0.0
Tia Haryanti_Kualifikasi.txt,pada tahun selanjutnya terdapat penelitian mengembangkan metode deteksi kelelahan pengemudi menggunakan cnn dengan parameter yang diukur yaitu posisi kepala dan mata.,23,1,12,0.1111111111111111,0.0,0.02127659574468085
Tia Haryanti_Kualifikasi.txt,nilai akurasi yang didapat rata rata 8955 li x.,24,1,0,0.0,0.0425531914893617,0.0
Tia Haryanti_Kualifikasi.txt,xia j.,25,1,0,0.0,0.0851063829787234,0.0
Tia Haryanti_Kualifikasi.txt,cao l.,26,1,0,0.0,0.1276595744680851,0.0
Tia Haryanti_Kualifikasi.txt,zhang g.,27,1,0,0.0,0.1702127659574468,0.0
Tia Haryanti_Kualifikasi.txt,feng x 2021.,28,1,0,0.0,0.2127659574468085,0.0
Tia Haryanti_Kualifikasi.txt,tahun 2022 terdapat dua penelitan pengembangan sistem untuk meningkatkan akurasi deteksi kel elahan dan memperbaiki kinerja sistem.,29,1,12,0.11764705882352941,0.2553191489361702,0.02127659574468085
Tia Haryanti_Kualifikasi.txt,deteksi pada kondisi siang hari saat pengemudi menggunakan kacamata memiliki nilai akurasi 98 alharbey r.,30,1,11,0.1875,0.2978723404255319,0.0
Tia Haryanti_Kualifikasi.txt,dessouky m.,31,1,0,0.0,0.3404255319148936,0.0
Tia Haryanti_Kualifikasi.txt,m.,32,1,0,0.0,0.3829787234042553,0.0
Tia Haryanti_Kualifikasi.txt,sedik a.,33,1,0,0.0,0.425531914893617,0.0
Tia Haryanti_Kualifikasi.txt,siam a.,34,1,0,0.0,0.46808510638297873,0.0
Tia Haryanti_Kualifikasi.txt,i.,35,1,0,0.0,0.5106382978723404,0.0
Tia Haryanti_Kualifikasi.txt,elaskily m.,36,1,0,0.0,0.5531914893617021,0.0
Tia Haryanti_Kualifikasi.txt,a 2022.,37,1,0,0.0,0.5957446808510638,0.0
