nama_dokumen,summary
Alfharizky Fauzi_Kualifikasi.txt,penyakit kulit merupakan masalah kesehatan yang tersebar luas dan menyerang orang orang dari segala usia dan penyakit ini dapat disebabkan oleh berbagai faktor seperti genetika gaya hidup dan paparan lingkungan. kelainan kulit merupakan hal y ang umum terjadi di seluruh dunia termasuk di indonesia dimana penyakit ini menimbulkan tantangan besar terhadap kesehatan masyarakat karena tingginya angka kejadiannya j. zhang et al. penyakit penyakit ini tidak hanya menimbulkan gejala fisik tetapi juga mempunyai dampak psikologis yang mendalam mempengaruhi kualitas hidup pasien dan interaksi sosial. dengan perkembangan teknologi terutama di bidang kecerdasan buatan artificial intelligence atau ai ada potensi untuk mengoptimalkan proses diagnosis penyakit kulit.
Alifurrohman_Kualifikasi.txt,"Algoritma dan metode statistik diterapkan untuk memberikan komputer kemampuan untuk ""belajar"" dari data dan meningkatkan kinerjanya dalam memecahkan masalah tanpa harus memprogram secara eksplisit untuk setiap masalah (Ni, Qiuping & Tang, Yuanxiang, 2023). Machine learning dibagi menjadi tiga kategori supervised learning, unsupervised learning dan reinforcement learning (Karimi-Mamaghan, M., Mohammadi, M., Meyer, P., Karimi-Mamaghan, A. M., & Talbi, E. G, 2022). Algoritma RL dapat dibagi menjadi dua kategori yaitu pembelajaran berbasis model dan pembelajaran bebas model (Mousavi, Seyed Sajad, Howley, Enda & Schukat, Michael, 2018). Pembelajaran bebas model lebih rendah daripada yang pertama dalam hal kecepatan pelatihan, tetapi lebih mudah diimplementasikan dan dapat dengan cepat menyesuaikan diri dengan keadaan yang lebih baik dalam skenario nyata. Penerapan reinforcement learning telah menunjukkan hasil yang signifikan pada berbagai bidang seperti robotika (Jens Kober, J Andrew Bagnell, Jan Peters, 2013), permainan (Silver, D., Huang, A., Maddison, C. et al. Perkembangan teknik machine learning, khususnya dalam deep learning,
telah memungkinkan penggunaan arsitektur neural network yang lebih kompleks untuk memecahkan berbagai masalah yang sulit diselesaikan dengan pendekatan konvensional. Mekanisme ini pertama kali diperkenalkan dalam konteks model Transformer (Vaswani et al., 2017), dan telah digunakan secara luas dalam berbagai aplikasi salah satunya pengoptimalan rute logistik (Xin, Liang, Wen Song, Zhiguang Cao, and Jie Zhang, 2021). Penelitian terkait VRP adalah kunci untuk meningkatkan daya saing pada industri logistik."
Armando Tirta Dwilaga_Kualifikasi.txt,memilih suatu produk pembeli mempertimbangkan beberapa aspek salah satunya adalah kualitas produk . penggunaan teknologi oleh usaha kecil dan menengah masih terbatas yang sering kali disebabkan oleh keterbatasan kemampuan dan pengetahuan sumber daya manusia sdm. konteks ini tidak hanya dilihat sebagai alat untuk meningkatkan efisiensi operasional tetapi juga sebagai sarana untuk meningkatkan daya saing dan memperluas pasar hernita surya perwira abubakar idris 2021. landasan pengendalian kualitas dalam produksi massal adalah penggunaan metrik yang berbeda untuk mengukur seberapa dekat produk mematuhi spesifikasi yang ditetapkan perusahaan. pemeriksaan terhadap data yang dikumpulkan dan asumsi yang sering diabaikan atau salah mengenai keakuratannya adalah sumber permasalahannya oborski wysocki 2022. produksi massal dalam permulaan produk yang cacat adalah masalah besar karena hal ini berarti membutuhkan biaya pengerjaan ulang atau pembongkaran yang besar. jika cacat tidak segera ditemukan cacat tersebut mungkin akan terus berlanjut selama proses berl angsung dan menyebabkan masalah yang lebih serius.
Devi Resviani_KUALIFIKASI.txt,teknologi informasi ti di era digital berkembang pesat untuk memenuhi kebutuhan bisnis yang terus berubah serta munculnya teknologi baru secara berkala. kapabilitas ti yang dinamis mencakup kemampuan untuk memperoleh menerapkan mengintegrasikan dan menata ulang sumber daya ti guna mencapai tujuan bisnis t. li chan 2019 .
Erfiana Wahyuningsih_UK.txt,pada tahun 2013 sram memakan 90 area chip menjadikannya komponen utama sirkuit digital. hal ini disebabkan memori ialah sumber kekuatan statis yang penting dalam sebuah sirkuit digital 1. konverter data yaitu analog ke digital converter adc telah mendorong industri semikonduktor untuk memaksimalkan fungsi kerja pada setiap komponen dalam b eberapa tahun terakhir.
Fitriana Indah Pramitasari_Kualifikasi.txt,menurut data yang bersumber dari bps tahun 2023 jumlah usaha pertanian perorangan utp sebanyak 29.342.202 unit atau turun 745 persen dari tahun 2013 yang sebanyak 31.705.295 unit. selain itu usia petani menjadi salah satu faktor menurunnya produktivitas petani. sebanyak 58 dari total petani di indonesia berusia 45 tahun. berdasarkan indeks ketahanan pangan gfsi 2022 dapat diukur dengan empat indikator yaitu keterjangkauan harga pangan affordability ketersediaan pasokan availability kualitas nutrisi quality and safety serta keber lanjutan dan adaptasi sustainability and adaptation . konsumsi pangan global cenderung meningkat lebih cepat dibandingkan pasokannya. et al 2022. kentang merupakan salah satu tanaman komersial penting yang berkontribusi terhadap ketahanan pangan dan mengurangi kemiskinan di kalangan petani kecil di negara berkembang mijena.
KUALIFIKASI_Riya Widayanti.txt,m 2018 sebelumnya menjelaskan bahwa teknologi informasi merupakan bidang ilmu yang setiap saat berkembang pesat dan tidak mungkin untuk memprediksi adanya perubahan dari awal tahun hingga akhir tahun. tetapi dalam penyediaan data setiap organisasi membutuhkan proses yang beradaptasi dengan perubahan dan mampu mendorong untuk bertransformasi ke arah digital agar mampu menyajikan data yang memudahkan dalam pengambilan keputusan. dua hal yang menjadi isu terpenting yaitu kecepatan data dan data yang terpercaya talend 2016. seiring tumbuhnya organisasi banyak data yang harus dikelola yang bisa menciptakan risiko kualitas data dan kurangnya kepatuhan terdahap perlindungan data itu sendiri.
Kualifikasi Witta Listiya Ningrum.txt,terkadang komentar dan diskusi terbuka bisa memicu perdebatan bisa karena perbedaan pendapat atau karena kesal dengan konten yang disajikan. namun seringkali perdebatan yang terjadi muncul halhal yang tidak baik dan menggunakan caracara yang kotor untuk berdebat. pada umumnya penggunaan sosial media dibuat untuk akun pribadi untuk masyarakat biasa ataupun artis hingga menjadi sebuah bisnis. toksisitas di 2 sosial media ini berupaya menyebarkan ujaran kebencian dan melecehkan orang lain dalam sebuah diskusi.
Kualifikasi_Aris Gunaryati.txt,metode peramalan data runtun waktu secara umum terbagi menjadi dua bagian. kedua metode peramalan yang didasarkan pada kecerdasan buatan seperti neural network algoritma genetika simulated annealing genetic programming klasifikasi dan model hybrid.
Kualifikasi_Rama Dian Syah.txt,keamanan data menjadi sangat penting pada media digital untuk menghindari kejahatan yang mengancam data yang bersifat rahasia dan privasi. kriptografi menggunakan berba gai macam teknik matematika untuk menjaga konten pada pesan terenkripsi joshi karkade 2015 .
Kualifikasi_Remigius.txt,inilah dunia y ang saat ini mulai dikenal sebagai metaverse zhao jiang chen liu yang xue chen 2022. istilah metaverse berasal dari kata majemuk meta dan universe yang berarti dunia baru yang mentransendensi realitas sebagai dunia virtual yang bekerja pintar smart dalam memenuhi harapan pengguna. istilah ini pertama kali diperkenalkan oleh neal s tephenson pada 1992 yang mengacu pada makna keterlibatan komunitas yang mendalam dan realitas virtual alternatif sebagai semesta yang terhubung ke dalam jeja ring internet menjadi realitas visual zhao et al .
Miftakhul Zaen_KUALIFIKASI.txt,pemahaman yang lebih dalam mengenai nilainilai yang ada seperti kebutuhan untuk mengatur d an memanipulasi kumpulan data yang begitu besar secara unik. klasteri sasi bertujuan untuk mengelompokkan data yang tidak berlabel sehingga objek objek data yang memiliki karakteristik dan atribut serupa akan ber kumpul dalam satu kluster sehingga kemiripan objek da ta dalam klaster yang sama akan lebih tinggi j ika dibandingkan dengan objek data klaster yang lain ikotun et al. 2023 . klasterisasi terdapat metode yang dapat digunakan seperti kmeans clustering ikotun et al. 2019 dbscan huang et al.
Ragmar Faikar Eka_Kualifikasi.txt,kelapa sawit merupakan salah satu perkebunan terbesar di indonesia dan menjadikan indonesia sebagai negara penghasil kelapa sawit terbesar di dunia luas perkebunan kelapa sawit di indonesia mempengaruhi vo lume produksi kelapa sawit produksi. hal ini didukung oleh letak geografis indonesia yang sesuai dengan kebutuhan tanaman kelapa sawit dibandingkan dengan tanaman perkebunan lainnya kelapa sawit mempunyai keunggulan sebagai bahan baku biodiesel dan pangan.
Reviana Siti Mardiah_Kualifikasi.txt,salah satu pendorong utama transformasi ini adalah kemajuan teknologi kecerdasan buatan artificial intelligence ai c. zhang lu 2021 khususnya di bidang machine learning ml alpaydin 2020 . negara memiliki kewajiban untuk memenuhi kebutuhan pangan penduduknya sebagaimana pemenuhan hak hak lainnya. ketika hak atas pangan terus menerus diabaikan maka hal itu sama saja dengan kejahatan genosida maskun naswar ahmad ilmar napang nugraha 2021 .
Reza Al Husna_Kualifikasi.txt,algoritma dl telah berhasil diterapkan dalam berbagai aplikasi termasuk pengenalan citra pemrosesan bahasa alami dan analisis data besar lecun bengio hinton 2015. dl sebagai subbidang dari ml telah membawa revolusi dalam visi komputer dengan memungkinkan pemodelan data yang kompleks dan pengenalan pola yang sangat efisien. 2 selama beberapa dekade terakhir pertanian telah menjadi sumber pendapatan utama bagi beberapa negara dan memberikan kontribusi signifikan terhadap perekonomian global parez et al. indonesia sebagai salah satu negara eksportir utama kakao dalam perdagangan internasional . indonesia setiap tahun mampu memproduksi biji kakao sekitar 700.000 ton.
Robert_Kualifikasi.txt,pada umumnya robot cerdas dikembangkan untuk bidang industri garcia jimenez de santos armada 2007 . robot sosial merupakan robot yang didisain untuk berinteraksi dengan manusia rawal stock homburg 2022 retto 2017 . 4 artificial intelligence ai adalah bidang yang digunakan agar mesin dapat berpikir dan mengambil keputusan layaknya seperti manusia khanzode 2020 . ai merupakan bidang yang sangat luas didalam ai terdapat machine learning ml di mana ml memungkinkan untuk mesin untuk belajar dari data yang diberikan serta berpikir dan mengambil keputusan awad khanna 2015 khanzode 2020 .
Tatya Atyanti Paramastri_Kualifikasi.txt,batik adalah salah satu pusaka budaya milik indonesia yang telah diakui oleh unesco sebagai mahakarya pusaka kemanusiaan lisan dan tak benda pada tahun 2009 silam. di yogyakarta sendiri terdapat sebutan batik daur hidup yogyakarta. upacara ritual yang terkait dengan daur hidup sangat erat dengan masyarakat jawa yang selalu mempertahankan keseimbangan dengan lingkungannya. daur hidup yang dikatakan adalah sejak janin dalam kandungan ibu lahir bertumbuh dan berkembang menikah sampai kembali kealam baka sekar jagad 2015. terdapat ratusan motif batik khas yogyakarta dimana masingmasing motif memiliki maknanya tersendiri. sebagai contoh pada motif yang umum dikenal seperti parang dan kawung motif parang rusak merupakan pola dasar dari parang motif ini memiliki makna perang melawan yang rusak yaitu perilaku yang tidak baik.
Tia Haryanti_Kualifikasi.txt,integrasi bidang teknologi informasi dengan ilmu ergonomi yang merupakan studi tentang efisien si dan optimalisasi kesejahteraan manusia dalam lingkungan kerja dapat menciptakan solusi secara teknologis serta mendukung kesejahteraan dan produktivitas manusia. pengembangan alat dan sistem yang dapat mempelajari dan menyesuaikan diri dengan kebutuhan pengguna memfasilitasi desain antarmuka yang lebih intuitif dan membantu dalam analisis ergonomis untuk identifikasi risiko kesehatan dan keselamatan. kecerdasan buatan dapat digunakan untuk menganalisis postur kerja mendeteksi kelelahan dan bahkan merekomendasikan perubahan untuk mengurangi risiko cedera atau meningkatkan kinerja. salah satu tantangan signifikan dalam keselamatan berkendara adalah mengatasi masalah kelelahan dan kantuk pada pengemudi sebelum mereka 2 memulai berkendara.
Utami Lestari_Kualifikasi.txt,teknologi informasi telah menyebar ke berbagai sektor serta memfasilitasi akses ke berbagai informasi mempercepat pertukaran data dan mengubah cara manusia berinteraksi. kecerdasan buatan atau ai mengacu pada aplikasi algoritma dan teknik perangkat lunak yang memungkinkan komputer dan mesin untuk mensimulasikan persepsi manusia dan proses pengambilan keputusan untuk menyelesaikan tugas dengan sukses murphy 2019 .
Yoga Panji Perdana Nugraha_Kualifikasi.txt,hal ini merupakan tantangan bagi para pelaku industri. sebagian besar perusahaan tidak hanya memiliki sedikit produk dan model dalam satu kali produksi. dengan mengandalakan tenaga manusia yang memiliki keterbat asan. sehingga dibutuhkan sebuah model pengganti untuk meningkatkan kinerja dari kegiatan inspeksi reyes luna chang tuck ashcroft 2023 . otomatisasi pada proses inspeksi kualitas adalah salah satu cara untuk me ningkatkan kinerja kegiatan inspeksi sehingga kepuasan pelanggan atas produk yang berkualitas baik dapat terjaga deshpande minai kumar 2020 . 2021 . artificial intelligence ai merupakan alternatif digital untuk meningkatkan kinerja kegiatan inspeksi jarkas et al. 2023 . deteksi objek merupakan hal yang penting dalam kegiatan inspeksi dalam industri yang et al. 2020 . acosta and oliveira santanna 2023 mengembangkan relevance mechine vector menggunakan teknik kernel sparse bayesian untuk meningkatkan support machine vector pada masalah regresi dan klasifikasi dengan menggunakan machine learning . penelitian tersebut menghasilkan perbandingan kinerja relevance machine vector dengan support vector machine artific ial neural network dan beta regression model menghasilkan bahwa pemantauan proses berbasis relevance machine vector adalah alat pemantauan kualitas produk cacat dalam proses manufaktur yang baik dibandingkan dengan algoritma machine learing yang lain.
