nama_dokumen,kalimat,summary
Kualifikasi_Aris Gunaryati.txt,3.1 gambaran umum penelitian motivasi dari metodologi yang diusulkan adalah membu at suatu metode peramalan yang sesuai dengan data runtun waktu yang ada serta meni ngkatkan akurasinya dengan tetap memp erhatikan efisiensi w aktu ko mputasi nya. langkahlangkah yang dilakuk an dalam p enelitian ini adalah m enganalisis data jum lah kasus h arian covid 19 di jakarta berdasarkan dataset dari situs ht tpscorona.jakarta.go.id tangg al 6 maret 2020 sampai 30 juni 2021 sebagai data training dan nanti akan diprediksi untuk tanggal 1 juli 2021 sampai dengan 31 juli 2021 sebagai data uji dengan tahapan sebagai berikut 1. mempersiapk an data runtun w aktu yang akan dia nalisis 2. menganalisis data runtun waktu yang ada meng gunakan metode statistika arima 3. menganalisis data runtun waktu yang ada menggunakan metode quantum neural network 4. mengembangkan model hybrid arimaquantum neural network 5. menentukan mod el yang cocok untuk s etiap variabel 6. menguji kecocokan masingmasing model 7. melakuk an peramalan dengan menggunakan mo del yang cocok 8. melakuk an perbandingan tingkat aku rasi hasil peramalan dengan tiap model untuk mend apatkan model peramalan yang diharapkan sesuai dengan data runtun waktu yang ada maka perlu dilakukan pendekatan ilmiah yaitu dengan melihat pola d ata runtun waktu yang ada terlebih dahulu. dengan melihat pola data awal yang di miliki maka akan memud ahkan dalam memi lih model yang sesuai untuk data tersebut. pendekatan lainnya adalah me nggunakan too ls untuk m enentukan secara otomatis bentuk model statistik arima yang sesuai dengan runtun waktu yang ada lalu model tersebut dilatih menggunakan quantum neural network agar diket ahui polapola d ata yang sudah ada d an d apat d iuji akurasinya.17 tipe model pola tipikal acf pola tipikal pacf ar p menurun secara ekspon ensial sinusoidal terputus s etelah lag p ma q terputus s etelah lag q menurun secara ekspon ensial sinusoidal arma p q menurun secara ekspon ensial sinusoidal menurun secara ekspon ensial sinusoidal 3.2 model arima bentuk u mum model ar ima dapat dinyatakan dalam p ersamaan berikut ............................... ................................ ................................. 1 operator ar adalah ............................................................2 operator ma adalah ............................................................ ............. .3 1. autore gressive integrated moving average arima not asi model arima p d q p orde untuk pros es autoregressive ar d orde yang menyatakan banyaknya proses dife rensi d ilakuk an pada data time series yang tidak stasione r q orde yang menyatakan proses moving a verage ma. pola teoretis acf dan pacf dari proses yang stasio ner sumber aswi dan sukarna 2006 2. tahapan analisis time series arima a. membuat plot time series identifikasi asumsi s tasione ritas data runtun waktu. suatu de ret pengamatan dikat akan stasioner apabila proses tidak berubah seiring dengan perubahan waktu tidak stasioner dalam mean jika trend tidak datar tidak sejajar smbu waktu tidak stasioner dalam varian jika trend datar atau hampir datar tetapi data tersebar membangun pola m elebar atau m enyempit pola t eromp et18 tidak stasioner dalam mean varians j ika trend tidak datar dan data memb entuk po la terompet. augmented di ckey fuller uji formal untuk stasion eritas hipotesis h0 terdapat akar unit dan data tidak st asioner 0 h1 tid ak terdapat akar unit dan data stasioner 0 span taraf signifik ansi  statistik uji ............................................................... ...4 ............................................................................................... .5 ............................................................................................... .......... .6 kriteria uji h0 ditolak jika nilai mu tlak dari augmented di ckey fuller nilai kritis mackinnon atau nilai prob . . b. menghitung membu at plot acf dan pacf mengidentifikasi model runtun w aktu yang mungkin mengestimasi p arameter model c. uji signifik ansi parameter hipotesis h0 danatau parameter tidak signifik an terhadap model h1 danatau parameter signifik an terhadap model taraf signifik ansi  statistik uji danatau 19 kriteria uji tolak h 0 jika atau p value alpha d. verifikasi mo del independensi residual hipotesis h0 tidak ada korelasi antarlag h1 paling sedikit ada satu dengan k12 24 36 48 ada ko relasi antarlag statistik uji kriteria uji tolak h 0 jika atau p value alpha dengan m l ag maksim um s jumlah p arameter yang diesti masi dan taraf signifik ans normalitas residual hipotesis h0 residual berdistriusi norm al h1 residual t idak berdistribusi norm al statistik uji fungsi peluang kumulatif r esidual distribusi ku mulatif yang diobs ervasi dari suatu sampel acak sebanyak n o servasi kriteria uji tolak h 0 jika atau p value alpha ukuran ketepatan ra malan mod el dengan uku ran ketepatan p eramalan yang baik ad alah model yang menghasilkan error yang kecil. nilai teng ah kesalahan kuadrat mean square er ror 20 berikut flo wchart langkahlangkah membu at model arima gambar 1. flowch art analisis runtun waktu arima 3.3 model neural network dalam buku jaringan syaraf tiruan dan pemrogramannya menggunakan matlab drs. jong jek siang m.sc menyebutkan bahwa jaringan syaraf tiruan adalah system pemroses informasi yang memiliki karakteristik mirip dengan jaringan syaraf biologi. jaringan syaraf t iruan dibentuk sebagai generalisasi model matematika dari jaringan syaraf biologi dengan asumsi bahwa pemrosesan informasi terjadi pada banyak elemen sederhana neuron a. sinyal dikirimkan di antara neuron neuron melalui penghubung penghubung b. penghubung ant ar neuron memiliki bobot yang akan memperkuat atau memperlemah sinyal c. untuk menentukan output setiap neuron menggunakan fungsi aktivasi biasanya bukan fungsi linier yang dikenakan pada jumlahan input yang diterima. besarnya output ini selanjutnya diband ingkan dengan suatu batas ambang treshhold 21 jaringan syaraf tiruan ditentukan oleh tiga hal a. pola hubungan antar neuron disebut arsitektur jaringan b. metode untuk menentukan bobot penghubung disebut metode traininglearning algoritma c. fungsi aktivasi gambar skematik tipikal neuron dapat dilihat pada gambar 2 gambar 2 syaraf biologis pemrosesan informasi dalam jaringan syaraf tiruan dapat disingkat sebagai berikut sinyal baik berupa aksi ataupun potensial muncul sebagai masukan unit sinapsis efek dari tiap sinyal ini dinyatakan sebagai bentuk perkalian dengan sebuah nilai bobot untuk mengindikasikan kekuatan dari sinapsis. semua sinyal yang diberi pengali bobo t ini kemudian dijumlahkan satu sama lain untuk menghasilkan unit aktivasi. jika aktivasi ini melampaui sebuah batas ambang tertentu maka unit tersebut akan memberikan keluaran dalam bentuk respon terhadap masukan. unit aktivasi ini kemudian dibandingkan d engan sebuah nilai ambang dan hasilnya dimasukkan kedalam fungsi transfer fungsi non linier yang akan menghasilkan sebuah keluaran. secara ringkas proses tersebut dapat digambarkan dalam gambar 3 gambar 3 neuron buatan mcculloch pitts sebagai operator matematis 22 aktivasi dari unit masukan diatur dan diteruskan melalui jaring hingga nilai dari keluaran dapat ditentukan. jaring berperan sebagai fungsi vektor yang mengambil satu vektor pada masukan dan mengeluarkan satu vektor lain pada keluaran. model jaringan syaraf tiruan dapat memiliki sebuah lapisan bobot dimana masukan dihubungkan langsung dengan keluaran atau beberapa lapisan yang didalamnya terdapat beberapa lapisan tersembunyi karena berada t ersembunyi diantara neuron masukan dan keluaran. jaring syaraf menggunakan unit tersembunyi untuk menghasilkan representasi pola masukan secara internal didalam jaring syaraf. fungsi transfer nonlinier yang digunakan dalam tiap neuron baik dilapisan masukan keluaran atau lapisan tersembunyi dapat berupa fungsi nilai ambang fungsi linier fungsi sigmoid ataupun fungsi gaussian tergantung dari karakter neuron sesuai keinginan kita. hal ini dapat dilihat pada gambar 4 gambar 4 tipikal sebuah jaringan syaraf tiruan 3.3.1 komponen jaringan syaraf terdapat beberapa tipe jaringan syaraf hampir semuanya memiliki komponen komponen yang sama. seperti halnya otak manusia jaringan syaraf juga terdiri atas beberapa neuron dan ada hubungan antar neu ron tersebut. neuron neuron tersebut akan mentransformasikan informasi yang diterima melalui sambungan keluarnya menuju ke neuron neuron yang lain. pada jaringan syaraf hubungan ini dikenal dengan nama bobot. informasi tersebut disimpan pada suatu nilai t ertentu pada bobot tersebut. neuron ini sebenarnya mirip dengan sel neuron biologis. neuron neuron buatan tersebut bekerja dengan cara yang sama pula dengan neuron biologis. informasi disebut dengan input akan dikirim ke neuron dengan bobot kedatangan t ertentu.,pendekatan lainnya adalah me nggunakan too ls untuk m enentukan secara otomatis bentuk model statistik arima yang sesuai dengan runtun waktu yang ada lalu model tersebut dilatih menggunakan quantum neural network agar diket ahui polapola d ata yang sudah ada d an d apat d iuji akurasinya.17 tipe model pola tipikal acf pola tipikal pacf ar p menurun secara ekspon ensial sinusoidal terputus s etelah lag p ma q terputus s etelah lag q menurun secara ekspon ensial sinusoidal arma p q menurun secara ekspon ensial sinusoidal menurun secara ekspon ensial sinusoidal 3.2 model arima bentuk u mum model ar ima dapat dinyatakan dalam p ersamaan berikut ............................... ................................ ................................. 1 operator ar adalah ............................................................2 operator ma adalah ............................................................ ............. .3 1. autore gressive integrated moving average arima not asi model arima p d q p orde untuk pros es autoregressive ar d orde yang menyatakan banyaknya proses dife rensi d ilakuk an pada data time series yang tidak stasione r q orde yang menyatakan proses moving a verage ma. pola teoretis acf dan pacf dari proses yang stasio ner sumber aswi dan sukarna 2006 2. tahapan analisis time series arima a. membuat plot time series identifikasi asumsi s tasione ritas data runtun waktu. jaringan syaraf t iruan dibentuk sebagai generalisasi model matematika dari jaringan syaraf biologi dengan asumsi bahwa pemrosesan informasi terjadi pada banyak elemen sederhana neuron a. sinyal dikirimkan di antara neuron neuron melalui penghubung penghubung b. penghubung ant ar neuron memiliki bobot yang akan memperkuat atau memperlemah sinyal c. untuk menentukan output setiap neuron menggunakan fungsi aktivasi biasanya bukan fungsi linier yang dikenakan pada jumlahan input yang diterima. jika aktivasi ini melampaui sebuah batas ambang tertentu maka unit tersebut akan memberikan keluaran dalam bentuk respon terhadap masukan. jaring berperan sebagai fungsi vektor yang mengambil satu vektor pada masukan dan mengeluarkan satu vektor lain pada keluaran. neuron neuron tersebut akan mentransformasikan informasi yang diterima melalui sambungan keluarnya menuju ke neuron neuron yang lain. pada jaringan syaraf hubungan ini dikenal dengan nama bobot. informasi disebut dengan input akan dikirim ke neuron dengan bobot kedatangan t ertentu.
Kualifikasi_Rama Dian Syah.txt,3.1 tahapan penelitian tahapan penelitian dibagi atas beberapa tahapan yang dilakukan dari awal sampai akhir. tahapan dimulai dari studi literatur sampai analisis yang membentuk alur secara sistematis. tahapan penelitian ini terpada pada gambar 3.1 gambar 3.1 tahapan penelitian tahapan penelitian pada gambar 3.1 menjelaskan tahapan yang dilakukan pada penelitian ini. tahapan pertama yaitu studi literatur dengan membaca dan memahami beberapa penelitian yang dilakukan oleh peneliti sebel umnya kemudian desain algoritma dilakukan pada matlab pengujian dilakukan dengan beberapa parameter pengujian dan analisis dilakukan dari beberapa pengujian yang telah dilakukan. 3.2 desain algoritma penelitian yang terdahulu menggunakan metode yang memiliki ke amanan tinggi yang dibuktikan dengan beberapa parameter pengujian. pada penelitian ini mengajukan pengembangan algoritma kriptografi citra digital dengan mengkombinasi teknik konfusi dengan algoritma cat map dan henon map serta teknik difusi dengan algoritma logistic map . pengembangan pada algoritma ini diharapkan dapat memiliki keamanan yang lebih tinggi dengan melalui beberapa parameter pengujian. diagram alur proses enkripsi dapat dilihat pada 3.2. 18 gambar 3.2 diagram alur proses enkripsi gambar 3.2 merupakan diagram alur proses enkripsi yang diusulkan pada penelitian ini. citra asli dan kunci enkripsi menjadi input pada proses enkripsi. langkah pertama yaitu p engacakan piksel dilakukan dengan algoritma cat map menggu nakan persamaan 2.1 dan algoritma henon map menggunakan persamaan 2.5 dan 2.6. kemudian pembangkitan keystream dengan algoritma logistic map menggunakan persamaan 2.9. keystream yang dibangkitkan akan dilakukan operasi xor dengan piksel citra asli sehingga menghasilkan citra terenkripsi. diagram alur proses dekripsi dapat dilihat pada gambar 3.3 gambar 3.3 diagram alur proses dekripsi 19 gambar 3.3 merupakan diagram alur proses dekripsi yang diusulkan pada penelitian ini. proses dekripsi merupakan k ebalikan dari proses enkripsi. citra terenkripsi dan kunci dekripsi menjadi input pada proses dekripsi. kunci enkripsi dan dekripsi merupakan kunci yang sama. langkah pertama yaitu pembangkitan keystream menggunakan logistic map . kemudian pengembalian nila i piksel dengan operasi xor. pengembalian posisi piksel dengan algoritma henon map menggunakan persamaan 2.7 dan 2.8 serta algoritma cat map menggunakan persamaan 2.2 sehingga menghasilkan citra asli kembali. 3.3 pengujian tahapan pengujian dilakukan unt uk mengetahui hasil pada proses enkripsi dan dekripsi beberapa pengujian yang dilakukan yaitu 1. histogram histogram merupakan analisis statistik yang menunjukkan penyebaran atau distribusi piksel pada citra. histogram sering digunakan untuk pada pengolahan citra untuk melihat kualitas citra. kriptografi pada citra digital yang ideal memiliki distribusi nilai p iksel yang beragam benlashram et al. 2020 . 2. psnr peak signal noise to ratio psnr digunakan untuk pengukuran kualitas citra antara citra asli dan noise yang terjadi pada citra terenkripsi. nilai psnr 30 db membuktikan kualitas yang ba ik pada citra asli atau citra terdekripsi lone et al. 2021 .,tahapan penelitian ini terpada pada gambar 3.1 gambar 3.1 tahapan penelitian tahapan penelitian pada gambar 3.1 menjelaskan tahapan yang dilakukan pada penelitian ini. diagram alur proses enkripsi dapat dilihat pada 3.2. citra asli dan kunci enkripsi menjadi input pada proses enkripsi. langkah pertama yaitu p engacakan piksel dilakukan dengan algoritma cat map menggu nakan persamaan 2.1 dan algoritma henon map menggunakan persamaan 2.5 dan 2.6. kemudian pembangkitan keystream dengan algoritma logistic map menggunakan persamaan 2.9. keystream yang dibangkitkan akan dilakukan operasi xor dengan piksel citra asli sehingga menghasilkan citra terenkripsi. kunci enkripsi dan dekripsi merupakan kunci yang sama. langkah pertama yaitu pembangkitan keystream menggunakan logistic map . 3.3 pengujian tahapan pengujian dilakukan unt uk mengetahui hasil pada proses enkripsi dan dekripsi beberapa pengujian yang dilakukan yaitu 1. histogram histogram merupakan analisis statistik yang menunjukkan penyebaran atau distribusi piksel pada citra.
Kualifikasi_Remigius.txt,3.1 motivasi penelitian penelitian ini dilakukan dengan motivasi mengenalkan pentingnya sistem pembelajaran bidang arsitektur menggunakan teknologi metaverse. dalam proses pengembangan sistem pembelajaran arsitektur berbasis metaverse ini peneliti juga ingin menunjukkan perlunya keterlibatan komunitas dan persepsi pengguna bidang arsitektur agar si stem pembelajaran yang dihasilkan sesuai dengan kebutuhan dan harapan mereka dalam meningkatkan efektivitas pembelajaran arsitektur itu sendiri. diharapkan sistem pembelajaran arsitektur berbasis metaverse ini dapat memberi kemudahan kepada komunitas dose n dan mahasiswa dalam mempelajari berbagai sisi arsitektur dengan memasuki dunia virtual dan mereka dapat memahami materi yang diajarkan serta memecahkan permasalahan arsitektur yang dihadapi secara interaktif kolaboratif dan imersif dengan solusi tepat tanpa harus mencari berbagai referensi wujud nyata arsitektur di dunia fisik atau dunia nyata. studi literatur yose indarta ambiyar agariadne dwinggo samala ronal watrianthos 2022 berjudul metaverse tantangan dan peluang dalam pendidikan menyimpu lkan bahwa implementasi metaverse di dunia pendidikan memiliki peluang besar dalam menunjang proses pelaksanaan pendidikan menjadi lebih baik. pendidikan berbasis audiovisual merupakan aplikasi metaverse paling popular dan banyak digunakan dalam pembelajar an. berdasar penelitian pendidikan berbasis pengalaman menjadi lebih baik apakah melalui belajar secara langsung maupun simulasi didukung teknologi. dengan konsep pembelajaran matakuliah perkembangan arsitektur 1 yang dilakukan dengan metode metaverse p embelajaran secara online ini dapat dilakukan dengan lebih interaktif. dalam proses metaverse menyediakan banyak dukungan dukungan pada proses pembelajaran online dengan tidak menghilangkan pengalaman belajar di kampus. metode belajar di mana saja dan kapan saja menjadi konsep menarik yang disenangi banyak pihak. seharusnya 30 waktu ruang dan biaya dan lainnya dapat dipangkas dengan kehadiran teknologi metaverse. 3.2 kerangka penelitian penelitian ini dilakukan dalam mencapai tujuan utama yaitu pengembangan sistem pembelajaran arsitektur berbasis metaverse terutama terkait perkembangan arsitektur. penelitian ini dilakukan melalui beberapa tahap antara lain tabel 3.2 tahapan pengembangan sistem pembelajaran perkembangan arsitektur 1 berbasis me taverse no. tahapan proses hasil 1. identifikasi topik pembelajaran menghimpun materi pembelajaran perkembangan arsitektur selama satu semester himpunan materi pembelajaran perkembangan arsitektur selama satu semester 2. konstruksi dunia visual melakukan konstruksi visual konstruksi fisik dan desain dunia fisik dan desain visual menyiapkan latar arsitektur dan tata letak dunia digital konstruksi avatar dan konten pembelajaran perkembangan arsitektur di dunia digital dunia virtual berbasis konten pembelajaran perkembangan arsitektur 3. penggunaan dunia nyata koneksi dunia virtual persistensi interaksi interaksi dunia virtual keterlibatan komunitas 31 4. efektivitas pembelajaran kolaboratif presensi imersi kehadiran dalam realitas yang disimulasi kapabilitas metaverse dalam membentuk lingkungan pengguna untuk memahami realitas pemahaman materi pembelajaran kemampuan memahami materi pembelajaran perkembangan arsitektur berbasis metaverse penelitian mengenai pengembangan sistem pembelajaran perkembangan arsitektur 1 berbasis metaverse ini dilakukan dengan melibatkan komunitas yang terdiri dari dosen dan mahasiswa di program studi s1 arsitektur jurusan teknik arsitektur.,studi literatur yose indarta ambiyar agariadne dwinggo samala ronal watrianthos 2022 berjudul metaverse tantangan dan peluang dalam pendidikan menyimpu lkan bahwa implementasi metaverse di dunia pendidikan memiliki peluang besar dalam menunjang proses pelaksanaan pendidikan menjadi lebih baik. 3.2 kerangka penelitian penelitian ini dilakukan dalam mencapai tujuan utama yaitu pengembangan sistem pembelajaran arsitektur berbasis metaverse terutama terkait perkembangan arsitektur. penelitian ini dilakukan melalui beberapa tahap antara lain tabel 3.2 tahapan pengembangan sistem pembelajaran perkembangan arsitektur 1 berbasis me taverse no.
Miftakhul Zaen_KUALIFIKASI.txt,3.1 tahapan penel itian dalam penelitian mengenai pengembangan algoritma dbscan dengan kuantum terdapat langkahlangkah yang dilakukan seperti pada gambar 3.1. langkah langkah yang dilaukan d iantaranya yaitu pengumpulan data definisi qubits kriteria inisialis asi sistem kuantum hingga evaluasi klaster. data definisi qubits kriteria inisialisasi sistem kuantum penentuan eps dan minpts kuantum identifikasi core supplier dengan kuantum sirkuitidentifikasi noise supplier dengan kuantum sirkuit penanganan noise dengan kuantum stateformasi klaster supplier dengan kuantum measurementimplementasi quantum distance measure identifikasi core supplier dengan kuantum sirkuit evaluasi klaster1 2 3 4 5 6 9 10 117 8 gamb ar 3.1 tahapan penel itian 1. data tahap awal dalam penelitian di awali dengan pembuatan data dimana data yang digunakan pada penel itian ini adalah data s intetik. data sintetik digunakan untuk mendapatkan jumlah data yang besar sela in itu data sintetik juga b ersifat fleksibel kar ena ju mlah data yang digunakan dapat ditentukan sesuai dengan kebutuhan pengujian algo ritma yang dikembang kan. data sintetik yang dibuat berisikan nama supplier harga kualitas dan waktu pengiriman. 2. definis i qubits kriteria pada taha p ini kriteria yang digunak an untuk pengelompokan supplier diubah menjadi representasi kuantum menggunakan qubits. setia p kriteria mungkin diwakili ol eh satu atau lebih qubits tergantung pada kompleksitas yang diperlukan. kriteri a yang digunakan dalam peng elompokan supplier yaitu harga kualitas dan waktu pengiri man. 3. inisialisasi sistem kuantum pada tahapan ini melakukan p ersiapan awal dari komputer k uantum yaitu mengatur qubits ke state awal dan memas tikan semua qubits berada dalam keadaan awal sebelum operasi kuantum dijalankan. pada tahapan ini juga menentuk kan jumlah qubits yan g digunakan. 4. implementasi quantum distance measure pada tahapan ini melakukan p enerapan metode untuk mengukur jarak antar supplier dalam ruang kuantum dengan menggunakan prins ipprinsip mekanika kuantum .,3.1 tahapan penel itian dalam penelitian mengenai pengembangan algoritma dbscan dengan kuantum terdapat langkahlangkah yang dilakukan seperti pada gambar 3.1. langkah langkah yang dilaukan d iantaranya yaitu pengumpulan data definisi qubits kriteria inisialis asi sistem kuantum hingga evaluasi klaster. setia p kriteria mungkin diwakili ol eh satu atau lebih qubits tergantung pada kompleksitas yang diperlukan.
Ragmar Faikar Eka_Kualifikasi.txt,bab metode penelitian menjelaskan mengenai tahapan yang dilakukan dalam penelitian beserta menjelaskan mengenai jadwal dan estimasi waktu tahapan yang dilakukan pada penelitian ini serta menjelaskan mengenai kegiatan yang dilakukan selama penelitian . tahapan penelitian dijelaskan dalam bentuk flowchart sehingga dapat menjelaskan proses yang dilakukan mulai dari studi literatur sampai dengan kesimpulan jadwal dan estimasi penelitian digambarkan dalam bentuk time table untuk menjadwalkan dan melakukan estimasi waktu dari tiap tahap yang dilakuk an. 3.1 tahapan penelitian terdapat beberapa tahapan yang dilakukan untuk melakukan penelitian ini beberapa tahapan yang dilakukan dapat dilihat pada gambar 3.1 . gambar 3.1 tahapan penelitian 31 3.1.1 studi literatur tahap pertama yang dilakukan yaitu studi literature yang bertujuan untuk mencari informasi atau pengetahuan dari paper atau buku sebagai teori pendukung untuk melakukan penelitian dan mencari novelty atau gap peneltian yang sudah dilakukan. paper dan buku yang digunakan dalam penelitian ini merupakan paper atau buku 5 tah un terakhir. 3.1.2 pengumpulan data tahap kedua yaitu pengumpulan data data yang digunakan pada penelitian ini adalah data citra digital kelapa sawit dengan tingkat kematangan belum matang setengah matang matang terlalu matang dan tandan buah yang kosong . data diambil dari beberapa sumber melalui website kaggle dan roboflow lalu dilakukan pemilihan gambar yang sesuai untuk dijadikan sebagai dataset. gambar 3.2 contoh data kelapa sawit dari masing masing kelas 3.1.3 preprocessing data sebelum data digunakan pada model machine learning yang dibuat data tersebut akan dilakukan preprocessing data agar data yang akan dilatih sesuai dengan keperluan yang dibutuhkan.,gambar 3.1 tahapan penelitian 31 3.1.1 studi literatur tahap pertama yang dilakukan yaitu studi literature yang bertujuan untuk mencari informasi atau pengetahuan dari paper atau buku sebagai teori pendukung untuk melakukan penelitian dan mencari novelty atau gap peneltian yang sudah dilakukan. paper dan buku yang digunakan dalam penelitian ini merupakan paper atau buku 5 tah un terakhir.
