nama_dokumen,kalimat,summary
Alfharizky Fauzi_Kualifikasi.txt,tujuan umum penelitian ini adalah mengembangkan prototype sistem identifikasi berbasis aplikasi yang dapat mengidentifikasi penyakit kelainan pada kulit manusia dan mengenalinya sebagai jenis penyakit kulit serta dapat memberikan keterangan dan penanganan dalam pengobatan menggunakan metode pengolahan citra dan teks . tujuan khusus penelitian adalah 1. mengembangkan metode identifikasi penyakit kulit sebagai pra diagnosis dengan menggabungkan dua metode pengolahan data yaitu pengolahan gambar dan pengolahan teks menjadi bi directional image text matching untuk mendapatkan hasil yang lebih akurat dalam identifikasi image to teks maupun sebaliknya teks to image . 2. menghasilkan model identifikasi bidirectional image teks matching yang dapat digunakan untuk identifikasi penyakit kulit yang dapat digunakan untuk prototype system identifikasi penyakit kulit berbasis aplikasi sebagai pra diagnosis pasien.,tujuan umum penelitian ini adalah mengembangkan prototype sistem identifikasi berbasis aplikasi yang dapat mengidentifikasi penyakit kelainan pada kulit manusia dan mengenalinya sebagai jenis penyakit kulit serta dapat memberikan keterangan dan penanganan dalam pengobatan menggunakan metode pengolahan citra dan teks . tujuan khusus penelitian adalah 1. mengembangkan metode identifikasi penyakit kulit sebagai pra diagnosis dengan menggabungkan dua metode pengolahan data yaitu pengolahan gambar dan pengolahan teks menjadi bi directional image text matching untuk mendapatkan hasil yang lebih akurat dalam identifikasi image to teks maupun sebaliknya teks to image .
Alifurrohman_Kualifikasi.txt,"Berdasarkan rumusan masalah yang telah dipaparkan, tujuan penelitian dari penelitian ini sebagai berikut. 1. Mengembangkan model berbasis Deep Q-Network (DQN) yang diperkaya dengan mekanisme Multi-Header Attention untuk menyelesaikan Dynamic Vehicle Routing Problem with Time Windows (DVRPTW). 2.",1. Mengembangkan model berbasis Deep Q-Network (DQN) yang diperkaya dengan mekanisme Multi-Header Attention untuk menyelesaikan Dynamic Vehicle Routing Problem with Time Windows (DVRPTW).
Armando Tirta Dwilaga_Kualifikasi.txt,berikut adalah tujuan penelitian yang melandasi dalam penelitian ini 1. membangun model algoritma convolutional neural networks cnn dalam melakukan klasifikasi cacat pada produk ban. 2. mengimplementasikan dan menghasilkan usulan model algoritma convolutional neural networks cnn dalam membangun sistem deteksi cacat produk ban. 3. mengukur kinerja dan performa model algoritma convolutional neural networks cnn dalam melakukan klasifikasi cacat pada produk ban.,2. mengimplementasikan dan menghasilkan usulan model algoritma convolutional neural networks cnn dalam membangun sistem deteksi cacat produk ban. 3. mengukur kinerja dan performa model algoritma convolutional neural networks cnn dalam melakukan klasifikasi cacat pada produk ban.
Devi Resviani_KUALIFIKASI.txt,adapun tujuan dari penelitian ini secara umum adalah memberikan solusi untuk pemeliharaan prediktif pada mesin kompresor reciprocating menggunakan machine learning . selain itu secara khusus tujuan penelitian ini adalah sebagai berikut 1. membandingkan efektivitas berbagai algoritma machine learning untuk memprediksi kegagalan pada mesin kompresor reciprocating. 2. menghasilkan model machine learning dari algoritma yang terpilih untuk memprediksi kegagalan pada mesin kompresor reciprocating. 3. menghasilkan prototipe sistem peringatan pemeliharaan prediktif berbasis machine learning pada mesin kompresor reciprocating. 4. mengevaluasi kinerja sistem peringatan pemeliharaan prediktif berbasis machine learning pada pada mesin kompresor reciprocating.,2. menghasilkan model machine learning dari algoritma yang terpilih untuk memprediksi kegagalan pada mesin kompresor reciprocating. 3. menghasilkan prototipe sistem peringatan pemeliharaan prediktif berbasis machine learning pada mesin kompresor reciprocating.
Erfiana Wahyuningsih_UK.txt,1. mereduksi jumlah transistor pada rangkaian sram dengan menggunakan metode m gdi. 2. mampu menunjukkan kinerja dari penggunaan low power pada rangkaian sram 6t 3. mampu mempertahankan high read stability pada rangkaian sram 6t,1. mereduksi jumlah transistor pada rangkaian sram dengan menggunakan metode m gdi. 2. mampu menunjukkan kinerja dari penggunaan low power pada rangkaian sram 6t 3. mampu mempertahankan high read stability pada rangkaian sram 6t
Fitriana Indah Pramitasari_Kualifikasi.txt,berikut tujuan penelitian ini adalah sebagai berikut. 1. menghasilkan platform koperasi petani kentang. 2. menghasilkan data prediksi permintaan di masa depan selama periode tertentu dan dicatat dalam blockchain. 3. menghasilkan data inventory secara realtime dan dicatat dalam blockchain.,1. menghasilkan platform koperasi petani kentang. 2. menghasilkan data prediksi permintaan di masa depan selama periode tertentu dan dicatat dalam blockchain.
KUALIFIKASI_Riya Widayanti.txt,adapun tujuan penelitiannya adalah sebagai berikut menghasilkan skema logika data yang digunakan dalam aplikasi block chain yang menjadi ko nsensus atau perjanjian bersama dalam studi kasus menghasilan arshitektur blockchain yang digunakan dalam konsensus bersama memetakan as pek data privasi yang digunakan dengan aturan kepatuhan data antara lain dengan uu ite,adapun tujuan penelitiannya adalah sebagai berikut menghasilkan skema logika data yang digunakan dalam aplikasi block chain yang menjadi ko nsensus atau perjanjian bersama dalam studi kasus menghasilan arshitektur blockchain yang digunakan dalam konsensus bersama memetakan as pek data privasi yang digunakan dengan aturan kepatuhan data antara lain dengan uu ite
Kualifikasi Witta Listiya Ningrum.txt,tujuan dalam penelitian ini adalah melakukan pengembangan model klasifikasi toksisitas multimodal dengan kombinasi jenis media teks gambar dan video pada platform sosial media menggunakan large language model llm. pengembangan ini dilakukan untuk meningkatkan kemampuan deteksi dan pemahaman konten berbahaya secara menyeluruh di platform sosial media. secara khusus dapat dijabarkan sebagai berikut 1. mengembangkan algoritma untuk merepresentasikan teks gambar dan video dari berbagai platform sosial media seperti twitter instagram dan tiktok. 2. mengembangkan model klasifikasi toksisitas menggunakan multimodal dengan metode large language model llm dengan jenis media teks gambar dan video.,pengembangan ini dilakukan untuk meningkatkan kemampuan deteksi dan pemahaman konten berbahaya secara menyeluruh di platform sosial media. secara khusus dapat dijabarkan sebagai berikut 1. mengembangkan algoritma untuk merepresentasikan teks gambar dan video dari berbagai platform sosial media seperti twitter instagram dan tiktok.
Kualifikasi_Aris Gunaryati.txt,tujuan penelitian berdasarkan rumus an masalah di atas maka tujuan penelitian ini adalah sebagai berikut 1. mempel ajari pola data runtun waktu pertambahan jumlah kasus harian covid 19 di jakarta dari tangg al 6 maret 2020 sampai tangg al 30 juni 2021 apakah merupakan runtun waktu seasonal atau non seasonal 2. menentukan model peramal an arima yang sesuai dengan data runtun w aktu tersebut 3. menentukan model peramalan untuk data runtun waktu tersebut meng gunakan metode neural network nn 4. menentukan model peramalan hybrid arima neural network untuk data runtun waktu tersebut 5. membuat dan mengembangkan model hybrid quantum arima nn yang dapat mem berikan hasil peramalan yang lebih akurat 6. membuat analisis hasil peramalan untuk jumlah kasus harian covid 19 di jakarta pada periode tanggal 1 juli sampai 31 juli 2020,tujuan penelitian berdasarkan rumus an masalah di atas maka tujuan penelitian ini adalah sebagai berikut 1. mempel ajari pola data runtun waktu pertambahan jumlah kasus harian covid 19 di jakarta dari tangg al 6 maret 2020 sampai tangg al 30 juni 2021 apakah merupakan runtun waktu seasonal atau non seasonal 2. menentukan model peramal an arima yang sesuai dengan data runtun w aktu tersebut 3. menentukan model peramalan untuk data runtun waktu tersebut meng gunakan metode neural network nn 4. menentukan model peramalan hybrid arima neural network untuk data runtun waktu tersebut 5. membuat dan mengembangkan model hybrid quantum arima nn yang dapat mem berikan hasil peramalan yang lebih akurat 6. membuat analisis hasil peramalan untuk jumlah kasus harian covid 19 di jakarta pada periode tanggal 1 juli sampai 31 juli 2020
Kualifikasi_Rama Dian Syah.txt,sesuai dengan masalah penelitian yang telah diuraikan sebelumnya maka tujuan yang ingin dicapai dalam penelitian ini adalah 1. menghasilkan pengembangan metode kriptografi citra digital berbasis chaotic . 2. mengimplementasi rancangan pengembangan metode kriptografi citra digital berbasis chaotic dan melakukan pengujian.,sesuai dengan masalah penelitian yang telah diuraikan sebelumnya maka tujuan yang ingin dicapai dalam penelitian ini adalah 1. menghasilkan pengembangan metode kriptografi citra digital berbasis chaotic . 2. mengimplementasi rancangan pengembangan metode kriptografi citra digital berbasis chaotic dan melakukan pengujian.
Kualifikasi_Remigius.txt,dengan masalah penelitian tersebut maka tujuan penelitian ini ditetapkan sebagai berikut. 1. menganalisis pengembangan sistem pembelajaran mengenai perkembangan arsitektur berbasis metavers e di program studi teknik arsitektur fakultas teknik sipil dan perencanaan universitas gunadarma. 2. menganalisis keterlibatan komunitas dan persepsi pengguna dalam sistem pembelajaran mengenai perkembangan arsitektur berbasis metaverse yang dikembangkan di program studi teknik arsitektur fakultas teknik sipil dan perencanaan universitas gunadarma. 3. menguji sistem pembelajaran mengenai perkembangan arsitektur berbasis metaverse yang melibatkan komunitas dan persepsi pengguna di program studi teknik arsitektur fakultas teknik sipil dan perencanaan universitas gunadarma.,1. menganalisis pengembangan sistem pembelajaran mengenai perkembangan arsitektur berbasis metavers e di program studi teknik arsitektur fakultas teknik sipil dan perencanaan universitas gunadarma. 2. menganalisis keterlibatan komunitas dan persepsi pengguna dalam sistem pembelajaran mengenai perkembangan arsitektur berbasis metaverse yang dikembangkan di program studi teknik arsitektur fakultas teknik sipil dan perencanaan universitas gunadarma.
Miftakhul Zaen_KUALIFIKASI.txt,berdasarka n rumusan masalah yang telah dipaparkan tujuan penelitian d apat dijelaskan sebagai berikut. 1. mengembangkan versi kuantum dari algorit ma dbscan untuk mengatasi keterbatasan dalam penanganan dataset besar pada klasterisasi supplier . 2. mengevaluasi peningkatan efisiensi dan akurasi yang dic apai oleh dbscan kuantum dala m pengelompokan supplier dibandingkan dengan pendekatan klasik.,1. mengembangkan versi kuantum dari algorit ma dbscan untuk mengatasi keterbatasan dalam penanganan dataset besar pada klasterisasi supplier . 2. mengevaluasi peningkatan efisiensi dan akurasi yang dic apai oleh dbscan kuantum dala m pengelompokan supplier dibandingkan dengan pendekatan klasik.
Ragmar Faikar Eka_Kualifikasi.txt,1. untuk merancang lightweight model klasifikasi kematangan buah kelapa sawit 2. untuk menggabungkan model konvolusi dan teknik attention module 3. untuk membuat aplikasi berbasis android untuk klasifikasi kematangan buah kelapa sawit 28 digunakan sesuai dengan tujuan penelitian tersebut.,1. untuk merancang lightweight model klasifikasi kematangan buah kelapa sawit 2. untuk menggabungkan model konvolusi dan teknik attention module 3. untuk membuat aplikasi berbasis android untuk klasifikasi kematangan buah kelapa sawit 28 digunakan sesuai dengan tujuan penelitian tersebut.
Reviana Siti Mardiah_Kualifikasi.txt,berdasarkan pokok permasalahan yang telah dirumuskan dalam rumusan masalah maka tujuan penelitian ini adalah sebagai berikut 1. mengembangkan model generative ai untuk menghasilkan data sintetis yang realistis yang dapat digunakan sebagai data pelatihan untuk model prediksi permintaan dan p roduksi beras . 2. mengembangkan model machine learning yang efektif dalam memprediksi permintaan dan produksi beras . 3. merancang model optimasi yang efektif untuk menentukan jumlah cadangan beras pemerintah yang optimal. 4. mambangun prototype decision support system untuk cadangan beras pemerintah .,berdasarkan pokok permasalahan yang telah dirumuskan dalam rumusan masalah maka tujuan penelitian ini adalah sebagai berikut 1. mengembangkan model generative ai untuk menghasilkan data sintetis yang realistis yang dapat digunakan sebagai data pelatihan untuk model prediksi permintaan dan p roduksi beras . 2. mengembangkan model machine learning yang efektif dalam memprediksi permintaan dan produksi beras .
Reza Al Husna_Kualifikasi.txt,tujuan penelitian yang ingin dicapai pada penelitian ini adalah 1. menghasilkan algoritma dan metode dengan pendekatan feature fusion berbasis attention untuk deteksi citra penyakit daun tanaman kakao . 2. menghasilkan sistem deteksi untuk mengenali gejala pada daun yang terinfeksi penyakit.,tujuan penelitian yang ingin dicapai pada penelitian ini adalah 1. menghasilkan algoritma dan metode dengan pendekatan feature fusion berbasis attention untuk deteksi citra penyakit daun tanaman kakao . 2. menghasilkan sistem deteksi untuk mengenali gejala pada daun yang terinfeksi penyakit.
Robert_Kualifikasi.txt,tujuan dari penelitian ini adalah 1. menghasilkan metode dan algoritma ekstrasi fitur ekspresi wajah berbasis morfologi matematika. 2. menghasilkan model klasifikasi mnn yang dapat digunakan untuk pengenalan ekspresi wajah . 3. menghasilkan prototype perangkat lunak sistem pengenalan ekspresi wajah .,tujuan dari penelitian ini adalah 1. menghasilkan metode dan algoritma ekstrasi fitur ekspresi wajah berbasis morfologi matematika. 2. menghasilkan model klasifikasi mnn yang dapat digunakan untuk pengenalan ekspresi wajah .
Tatya Atyanti Paramastri_Kualifikasi.txt,berdasarkan rumusan masalah maka tujuan dari penelitian ini adalah 1. mengumpulkan informasi batik daur hidup yogyakarta yang akurat. 2. menentukan kelas pada motif batik daur hidup yogyakarta yang mewakilinya. 3. mengembangkan algoritma kuantum pada segmentasi dan klasifikasi motif batik daur hidup yogyakarta. 4. mengukur nilai akurasi yang dihasilkan dari model segmentasi dan klasifikasi motif batik daur hidup yogyakarta dengan algoritma kuantum.,3. mengembangkan algoritma kuantum pada segmentasi dan klasifikasi motif batik daur hidup yogyakarta. 4. mengukur nilai akurasi yang dihasilkan dari model segmentasi dan klasifikasi motif batik daur hidup yogyakarta dengan algoritma kuantum.
Tia Haryanti_Kualifikasi.txt,tujuan umum penelitian adalah mengembangkan sistem deteksi kantuk predriving yang inovatif dengan menggunakan kecerdasan artifisial untuk meningkatkan keselamatan dan kesejahteraan pengemudi. tujuan khusus penelitian ini yaitu sebagai berikut 1. membangun dataset baru dari data citra wajah dan data fisiologis untuk pelatihan dan pengujian model deteksi kantuk predriving. 2. Mengidentifikasi parameter visual dan fisiologis yang dapat digunakan dalam sistem deteksi dini kantuk berbasis kecerdasan artifisial. 3.,tujuan umum penelitian adalah mengembangkan sistem deteksi kantuk predriving yang inovatif dengan menggunakan kecerdasan artifisial untuk meningkatkan keselamatan dan kesejahteraan pengemudi. Mengidentifikasi parameter visual dan fisiologis yang dapat digunakan dalam sistem deteksi dini kantuk berbasis kecerdasan artifisial.
Utami Lestari_Kualifikasi.txt,secara umum penelitian ini bertujuan untuk menciptakan platform tinjauan artikel ilmiah berbasis kecerdasan buatan dengan menggunakan model bahasa besar. tujuan penelitian secara khusus adalah sebagai berikut 1.membangun model platform tinjauan artikel ilmiah dengan llm 2. mengembangkan algoritma untuk klasifikasi artikel ilmiah untuk publikasi jurnal,secara umum penelitian ini bertujuan untuk menciptakan platform tinjauan artikel ilmiah berbasis kecerdasan buatan dengan menggunakan model bahasa besar. tujuan penelitian secara khusus adalah sebagai berikut 1.membangun model platform tinjauan artikel ilmiah dengan llm 2. mengembangkan algoritma untuk klasifikasi artikel ilmiah untuk publikasi jurnal
Yoga Panji Perdana Nugraha_Kualifikasi.txt,tujuan penelitian merupakan jawaban dari rumusan masalah yang menjadi hasil akhir dari penelitian. berikut ini adalah tujuan penelitian. 1. menghasilkan aplikasi deteksi objek yang dapat mengidentifikasi kecacatan produk sebagai pengganti manusia untuk kegiatan inspeksi produk pada perusahaan.,tujuan penelitian merupakan jawaban dari rumusan masalah yang menjadi hasil akhir dari penelitian. berikut ini adalah tujuan penelitian.
